"article","article_name","chapter","chapter_name","content"
"7","National cybersecurity strategy","II","COORDINATED CYBERSECURITY FRAMEWORKS","1. Each Member State shall adopt a national cybersecurity strategy that provides for the strategic objectives, the resources required to achieve those objectives, and appropriate policy and regulatory measures, with a view to achieving and maintaining a high level of cybersecurity. The national cybersecurity strategy shall include: (a) objectives and priorities of the Member State’s cybersecurity strategy covering in particular the sectors referred to in Annexes I and II; (b) a governance framework to achieve the objectives and priorities referred to in point (a) of this paragraph, including the policies referred to in paragraph 2; (c) a governance framework clarifying the roles and responsibilities of relevant stakeholders at national level, underpinning the cooperation and coordination at the national level between the competent authorities, the single points of contact, and the CSIRTs under this Directive, as well as coordination and cooperation between those bodies and competent authorities under sector-specific Union legal acts; (d) a mechanism to identify relevant assets and an assessment of the risks in that Member State; (e) an identification of the measures ensuring preparedness for, responsiveness to and recovery from incidents, including cooperation between the public and private sectors; (f) a list of the various authorities and stakeholders involved in the implementation of the national cybersecurity strategy; (g) a policy framework for enhanced coordination between the competent authorities under this Directive and the competent authorities under Directive (EU) 2022/2557 for the purpose of information sharing on risks, cyber threats, and incidents as well as on non-cyber risks, threats and incidents and the exercise of supervisory tasks, as appropriate; (h) a plan, including necessary measures, to enhance the general level of cybersecurity awareness among citizens. 2. As part of the national cybersecurity strategy, Member States shall in particular adopt policies: (a) addressing cybersecurity in the supply chain for ICT products and ICT services used by entities for the provision of their services; (b) on the inclusion and specification of cybersecurity-related requirements for ICT products and ICT services in public procurement, including in relation to cybersecurity certification, encryption and the use of open-source cybersecurity products; (c) managing vulnerabilities, encompassing the promotion and facilitation of coordinated vulnerability disclosure under Article 12(1); (d) related to sustaining the general availability, integrity and confidentiality of the public core of the open internet, including, where relevant, the cybersecurity of undersea communications cables; (e) promoting the development and integration of relevant advanced technologies aiming to implement state-of-the-art cybersecurity risk-management measures; (f) promoting and developing education and training on cybersecurity, cybersecurity skills, awareness raising and research and development initiatives, as well as guidance on good cyber hygiene practices and controls, aimed at citizens, stakeholders and entities; (g) supporting academic and research institutions to develop, enhance and promote the deployment of cybersecurity tools and secure network infrastructure; (h) including relevant procedures and appropriate information-sharing tools to support voluntary cybersecurity information sharing between entities in accordance with Union law; (i) strengthening the cyber resilience and the cyber hygiene baseline of small and medium-sized enterprises, in particular those excluded from the scope of this Directive, by providing easily accessible guidance and assistance for their specific needs; (j) promoting active cyber protection. 3. Member States shall notify their national cybersecurity strategies to the Commission within three months of their adoption. Member States may exclude information which relates to their national security from such notifications. 4. Member States shall assess their national cybersecurity strategies on a regular basis and at least every five years on the basis of key performance indicators and, where necessary, update them. ENISA shall assist Member States, upon their request, in the development or the update of a national cybersecurity strategy and of key performance indicators for the assessment of that strategy, in order to align it with the requirements and obligations laid down in this Directive."
"8","Competent authorities and single points of contact","II","COORDINATED CYBERSECURITY FRAMEWORKS","1. Each Member State shall designate or establish one or more competent authorities responsible for cybersecurity and for the supervisory tasks referred to in Chapter VII (competent authorities). 2. The competent authorities referred to in paragraph 1 shall monitor the implementation of this Directive at national level. 3. Each Member State shall designate or establish a single point of contact. Where a Member State designates or establishes only one competent authority pursuant to paragraph 1, that competent authority shall also be the single point of contact for that Member State. 4. Each single point of contact shall exercise a liaison function to ensure cross-border cooperation of its Member State’s authorities with the relevant authorities of other Member States, and, where appropriate, with the Commission and ENISA, as well as to ensure cross-sectoral cooperation with other competent authorities within its Member State. 5. Member States shall ensure that their competent authorities and single points of contact have adequate resources to carry out, in an effective and efficient manner, the tasks assigned to them and thereby to fulfil the objectives of this Directive. 6. Each Member State shall notify the Commission without undue delay of the identity of the competent authority referred to in paragraph 1 and of the single point of contact referred to in paragraph 3, of the tasks of those authorities, and of any subsequent changes thereto. Each Member State shall make public the identity of its competent authority. The Commission shall make a list of the single points of contact publicly available."
"9","National cyber crisis management frameworks","II","COORDINATED CYBERSECURITY FRAMEWORKS","1. Each Member State shall designate or establish one or more competent authorities responsible for the management of large-scale cybersecurity incidents and crises (cyber crisis management authorities). Member States shall ensure that those authorities have adequate resources to carry out, in an effective and efficient manner, the tasks assigned to them. Member States shall ensure coherence with the existing frameworks for general national crisis management. 2. Where a Member State designates or establishes more than one cyber crisis management authority pursuant to paragraph 1, it shall clearly indicate which of those authorities is to serve as the coordinator for the management of large-scale cybersecurity incidents and crises. 3. Each Member State shall identify capabilities, assets and procedures that can be deployed in the case of a crisis for the purposes of this Directive. 4. Each Member State shall adopt a national large-scale cybersecurity incident and crisis response plan where the objectives of and arrangements for the management of large-scale cybersecurity incidents and crises are set out. That plan shall lay down, in particular: (a) the objectives of national preparedness measures and activities; (b) the tasks and responsibilities of the cyber crisis management authorities; (c) the cyber crisis management procedures, including their integration into the general national crisis management framework and information exchange channels; (d) national preparedness measures, including exercises and training activities; (e) the relevant public and private stakeholders and infrastructure involved; (f) national procedures and arrangements between relevant national authorities and bodies to ensure the Member State’s effective participation in and support of the coordinated management of large-scale cybersecurity incidents and crises at Union level. 5. Within three months of the designation or establishment of the cyber crisis management authority referred to in paragraph 1, each Member State shall notify the Commission of the identity of its authority and of any subsequent changes thereto. Member States shall submit to the Commission and to the European cyber crisis liaison organisation network (EU-CyCLONe) relevant information relating to the requirements of paragraph 4 about their national large-scale cybersecurity incident and crisis response plans within three months of the adoption of those plans. Member States may exclude information where and to the extent that such exclusion is necessary for their national security."
"10","Computer security incident response teams (CSIRTs)","II","COORDINATED CYBERSECURITY FRAMEWORKS","1. Each Member State shall designate or establish one or more CSIRTs. The CSIRTs may be designated or established within a competent authority. The CSIRTs shall comply with the requirements set out in Article 11(1), shall cover at least the sectors, subsectors and types of entity referred to in Annexes I and II, and shall be responsible for incident handling in accordance with a well-defined process. 2. Member States shall ensure that each CSIRT has adequate resources to carry out effectively its tasks as set out in Article 11(3). 3. Member States shall ensure that each CSIRT has at its disposal an appropriate, secure, and resilient communication and information infrastructure through which to exchange information with essential and important entities and other relevant stakeholders. To that end, Member States shall ensure that each CSIRT contributes to the deployment of secure information-sharing tools. 4. The CSIRTs shall cooperate and, where appropriate, exchange relevant information in accordance with Article 29 with sectoral or cross-sectoral communities of essential and important entities. 5. The CSIRTs shall participate in peer reviews organised in accordance with Article 19. 6. Member States shall ensure the effective, efficient and secure cooperation of their CSIRTs in the CSIRTs network. 7. The CSIRTs may establish cooperation relationships with third countries’ national computer security incident response teams. As part of such cooperation relationships, Member States shall facilitate effective, efficient and secure information exchange with those third countries’ national computer security incident response teams, using relevant information-sharing protocols, including the traffic light protocol. The CSIRTs may exchange relevant information with third countries’ national computer security incident response teams, including personal data in accordance with Union data protection law. 8. The CSIRTs may cooperate with third countries’ national computer security incident response teams or equivalent third-country bodies, in particular for the purpose of providing them with cybersecurity assistance. 9. Each Member State shall notify the Commission without undue delay of the identity of the CSIRT referred to in paragraph 1 of this Article and the CSIRT designated as coordinator pursuant to Article 12(1), of their respective tasks in relation to essential and important entities, and of any subsequent changes thereto. 10. Member States may request the assistance of ENISA in developing their CSIRTs."
"11","Requirements, technical capabilities and tasks of CSIRTs","II","COORDINATED CYBERSECURITY FRAMEWORKS","1. The CSIRTs shall comply with the following requirements: (a) the CSIRTs shall ensure a high level of availability of their communication channels by avoiding single points of failure, and shall have several means for being contacted and for contacting others at all times; they shall clearly specify the communication channels and make them known to constituency and cooperative partners; (b) the CSIRTs’ premises and the supporting information systems shall be located at secure sites; (c) the CSIRTs shall be equipped with an appropriate system for managing and routing requests, in particular to facilitate effective and efficient handovers; (d) the CSIRTs shall ensure the confidentiality and trustworthiness of their operations; (e) the CSIRTs shall be adequately staffed to ensure availability of their services at all times and they shall ensure that their staff is trained appropriately; (f) the CSIRTs shall be equipped with redundant systems and backup working space to ensure continuity of their services. The CSIRTs may participate in international cooperation networks. 2. Member States shall ensure that their CSIRTs jointly have the technical capabilities necessary to carry out the tasks referred to in paragraph 3. Member States shall ensure that sufficient resources are allocated to their CSIRTs to ensure adequate staffing levels for the purpose of enabling the CSIRTs to develop their technical capabilities. 3. The CSIRTs shall have the following tasks: (a) monitoring and analysing cyber threats, vulnerabilities and incidents at national level and, upon request, providing assistance to essential and important entities concerned regarding real-time or near real-time monitoring of their network and information systems; (b) providing early warnings, alerts, announcements and dissemination of information to essential and important entities concerned as well as to the competent authorities and other relevant stakeholders on cyber threats, vulnerabilities and incidents, if possible in near real-time; (c) responding to incidents and providing assistance to the essential and important entities concerned, where applicable; (d) collecting and analysing forensic data and providing dynamic risk and incident analysis and situational awareness regarding cybersecurity; (e) providing, upon the request of an essential or important entity, a proactive scanning of the network and information systems of the entity concerned to detect vulnerabilities with a potential significant impact; (f) participating in the CSIRTs network and providing mutual assistance in accordance with their capacities and competencies to other members of the CSIRTs network upon their request; (g) where applicable, acting as a coordinator for the purposes of the coordinated vulnerability disclosure under Article 12(1); (h) contributing to the deployment of secure information-sharing tools pursuant to Article 10(3). The CSIRTs may carry out proactive non-intrusive scanning of publicly accessible network and information systems of essential and important entities. Such scanning shall be carried out to detect vulnerable or insecurely configured network and information systems and inform the entities concerned. Such scanning shall not have any negative impact on the functioning of the entities’ services. When carrying out the tasks referred to in the first subparagraph, the CSIRTs may prioritise particular tasks on the basis of a risk-based approach. 4. The CSIRTs shall establish cooperation relationships with relevant stakeholders in the private sector, with a view to achieving the objectives of this Directive. 5. In order to facilitate cooperation referred to in paragraph 4, the CSIRTs shall promote the adoption and use of common or standardised practices, classification schemes and taxonomies in relation to: (a) incident-handling procedures; (b) crisis management; and (c) coordinated vulnerability disclosure under Article 12(1)."
"12","Coordinated vulnerability disclosure and a European vulnerability database","II","COORDINATED CYBERSECURITY FRAMEWORKS","1. Each Member State shall designate one of its CSIRTs as a coordinator for the purposes of coordinated vulnerability disclosure. The CSIRT designated as coordinator shall act as a trusted intermediary, facilitating, where necessary, the interaction between the natural or legal person reporting a vulnerability and the manufacturer or provider of the potentially vulnerable ICT products or ICT services, upon the request of either party. The tasks of the CSIRT designated as coordinator shall include: (a) identifying and contacting the entities concerned; (b) assisting the natural or legal persons reporting a vulnerability; and (c) negotiating disclosure timelines and managing vulnerabilities that affect multiple entities. Member States shall ensure that natural or legal persons are able to report, anonymously where they so request, a vulnerability to the CSIRT designated as coordinator. The CSIRT designated as coordinator shall ensure that diligent follow-up action is carried out with regard to the reported vulnerability and shall ensure the anonymity of the natural or legal person reporting the vulnerability. Where a reported vulnerability could have a significant impact on entities in more than one Member State, the CSIRT designated as coordinator of each Member State concerned shall, where appropriate, cooperate with other CSIRTs designated as coordinators within the CSIRTs network. 2. ENISA shall develop and maintain, after consulting the Cooperation Group, a European vulnerability database. To that end, ENISA shall establish and maintain the appropriate information systems, policies and procedures, and shall adopt the necessary technical and organisational measures to ensure the security and integrity of the European vulnerability database, with a view in particular to enabling entities, regardless of whether they fall within the scope of this Directive, and their suppliers of network and information systems, to disclose and register, on a voluntary basis, publicly known vulnerabilities in ICT products or ICT services. All stakeholders shall be provided access to the information about the vulnerabilities contained in the European vulnerability database. That database shall include: (a) information describing the vulnerability; (b) the affected ICT products or ICT services and the severity of the vulnerability in terms of the circumstances under which it may be exploited; (c) the availability of related patches and, in the absence of available patches, guidance provided by the competent authorities or the CSIRTs addressed to users of vulnerable ICT products and ICT services as to how the risks resulting from disclosed vulnerabilities can be mitigated."
"13","Cooperation at national level","II","COORDINATED CYBERSECURITY FRAMEWORKS","1. Where they are separate, the competent authorities, the single point of contact and the CSIRTs of the same Member State shall cooperate with each other with regard to the fulfilment of the obligations laid down in this Directive. 2. Member States shall ensure that their CSIRTs or, where applicable, their competent authorities, receive notifications of significant incidents pursuant to Article 23, and incidents, cyber threats and near misses pursuant to Article 30. 3. Member States shall ensure that their CSIRTs or, where applicable, their competent authorities inform their single points of contact of notifications of incidents, cyber threats and near misses submitted pursuant to this Directive. 4. In order to ensure that the tasks and obligations of the competent authorities, the single points of contact and the CSIRTs are carried out effectively, Member States shall, to the extent possible, ensure appropriate cooperation between those bodies and law enforcement authorities, data protection authorities, the national authorities under Regulations (EC) No 300/2008 and (EU) 2018/1139, the supervisory bodies under Regulation (EU) No 910/2014, the competent authorities under Regulation (EU) 2022/2554, the national regulatory authorities under Directive (EU) 2018/1972, the competent authorities under Directive (EU) 2022/2557, as well as the competent authorities under other sector-specific Union legal acts, within that Member State. 5. Member States shall ensure that their competent authorities under this Directive and their competent authorities under Directive (EU) 2022/2557 cooperate and exchange information on a regular basis with regard to the identification of critical entities, on risks, cyber threats, and incidents as well as on non-cyber risks, threats and incidents affecting entities identified as critical entities under Directive (EU) 2022/2557, and the measures taken in response to such risks, threats and incidents. Member States shall also ensure that their competent authorities under this Directive and their competent authorities under Regulation (EU) No 910/2014, Regulation (EU) 2022/2554 and Directive (EU) 2018/1972 exchange relevant information on a regular basis, including with regard to relevant incidents and cyber threats. 6. Member States shall simplify the reporting through technical means for notifications referred to in Articles 23 and 30."
