term,definition,sources,source_anchor
RECOVER (RC),"In the NIST Cybersecurity Framework (CSF), the process that is used to restore assets and operations that were impacted by a cybersecurity incident.",https://www.nist.gov/cyberframework/recover,https://cloudsecurityalliance.org/cloud-security-glossary#recover-rc
RESPOND (RS),"In the NIST Cybersecurity Framework (CSF), the process that is used to take action regarding a detected cybersecurity incident.","In the NIST Cybersecurity Framework (CSF), the process that is used to take action regarding a detected cybersecurity incident.",https://cloudsecurityalliance.org/cloud-security-glossary#respond-rs
REST (Representational State Transfer),REST (REpresentational State Transfer) is an architectural style that defines a set of constraints to be used for developing web services that use the Hypertext Transfer Protocol (HTTP/S). A RESTful interface provides interoperability between computer systems on the Internet and allows the requesting system to access and manipulate data by a uniform set of stateless operations. Data in devices not yet IoT enabled can be utilized by any application that can make RESTful HTTPS requests to read and write data from devices such as controllers.,https://www.controldesign.com/articles/2016/it-invades-controller-programming/ and https://en.wikipedia.org/wiki/Representational_state_transfer,https://cloudsecurityalliance.org/cloud-security-glossary#rest-representational-state-transfer
RTUs (Remote Terminal Units),"Remote Terminal Units (RTU) are also referred to as Remote Telemetry Units. An RTU is an electronic device which is controlled by a microprocessor. The main function of an RTU is to interface the SCADA or Distributed Control System (DCS) to physically present objects. The functionality of RTUs and PLCs has started to overlap due to cheaper hardware, thus encouraging the industry to standardize the language for programs on which RTUs run.",http://www.differencebetween.net/technology/industrial/difference-between-plc-and-rtu/,https://cloudsecurityalliance.org/cloud-security-glossary#rtus-remote-terminal-units
Ransomware,Ransomware is malicious software that gains access to an organization’s systems and data and then encrypts these systems and data rendering them inaccessible without the encryption key. The attacker supplies the decrypt key only if the victim pays a fee (ransom). Ransomware can gain access to systems through such avenues as users interacting with phishing emails or infected websites.,Disaster Recovery as a Service : CSA,https://cloudsecurityalliance.org/cloud-security-glossary#ransomware
Rapid Elasticity,"Resources can be rapidly and elastically provisioned, in some cases automatically, to rapidly scale out and back. To the CSC, the provisioned capabilities often appear unlimited and can be purchased in any quantity at any time",https://csrc.nist.gov/glossary/term/rapid_elasticity,https://cloudsecurityalliance.org/cloud-security-glossary#rapid-elasticity
Real Time Filtering,A control to track use patterns and information like what sites are visited and blocked some in real-time based on policies.,Enterprise Architecture Reference Guide v2 : CSA : Security and Risk Management (SRM) Domain,https://cloudsecurityalliance.org/cloud-security-glossary#real-time-filtering
Real-Time Internet Work Defense (SCAP),Security Content Automation Protocol is a continuous assurance process that verifies compliance with security policies and procedures in real time.,Enterprise Architecture Reference Guide v2 : CSA : Business Operation Support Services (BOSS) Domain,https://cloudsecurityalliance.org/cloud-security-glossary#real-time-internet-work-defense-scap
Recovery Plans,Recovery plans describe the processes and procedures required to restore service delivery after interruption or disaster. The plans will often include steps to gradually restore the service while monitoring the performance and system health of every reached milestone.,Enterprise Architecture Reference Guide v2 : CSA : Technology Solution Services (TSS) Domain - Information Services,https://cloudsecurityalliance.org/cloud-security-glossary#recovery-plans
Recovery Point Objective (RPO),The point in time to which data must be recovered after an outage.,https://csrc.nist.gov/glossary/term/recovery_point_objective,https://cloudsecurityalliance.org/cloud-security-glossary#recovery-point-objective-rpo
Recovery Time Objectives (RTO),The overall length of time an information system’s components can be in the recovery phase before negatively impacting the organization’s mission or mission/business processes.,https://csrc.nist.gov/glossary/term/recovery_time_objective,https://cloudsecurityalliance.org/cloud-security-glossary#recovery-time-objectives-rto
Recurrent Neural Network,"A type of Neural Network where the output from the previous step is fed as input to the current step. In traditional neural networks, all the inputs and outputs are independent of each other. The main and most important feature of RNN is its Hidden state, which remembers some information about a sequence. The state is also referred to as Memory State since it remembers the previous input to the network.",https://www.geeksforgeeks.org/introduction-to-recurrent-neural-network/,https://cloudsecurityalliance.org/cloud-security-glossary#recurrent-neural-network
Red Teaming,"the process of testing your cybersecurity effectiveness through the removal of defender bias by applying an adversarial lens to your organization. Red teaming occurs when ethical hackers are authorized by your organization to emulate real attackers’ tactics, techniques and procedures (TTPs) against your own systems.",https://csrc.nist.gov/glossary/term/red_team,https://cloudsecurityalliance.org/cloud-security-glossary#red-teaming
Reduced Instruction Set Computer (RISC),"RISC is a design philosophy aimed at delivering simple but powerful instructions that execute within a single cycle at a high clock speed. The RISC philosophy concentrates on reducing the complexity of instructions performed by the hardware because it is easier to provide greater flexibility and intelligence in software rather than hardware. As a result, a RISC design places greater demands on the compiler.",https://www.sciencedirect.com/topics/computer-science/reduced-instruction-set-computer,https://cloudsecurityalliance.org/cloud-security-glossary#reduced-instruction-set-computer-risc
Refactoring,"applications are modified and optimized to leverage cloud-native services and features as much as possible, it is more time consuming than rehosting, but allows for improved performance, scalability, and resilience. It requires updating security policies, procedures, and staff skills for the refactored application.",https://www.agilealliance.org/glossary/refactoring/,https://cloudsecurityalliance.org/cloud-security-glossary#refactoring
Reference architectures,"Templates for implementing cloud security, typically generalized (e.g., an IaaS security reference architecture). They can be very abstract, bordering on conceptual, or they can be quite detailed, down to specific controls and functions.",https://dodcio.defense.gov/Portals/0/Documents/Ref_Archi_Description_Final_v1_18Jun10.pdf,https://cloudsecurityalliance.org/cloud-security-glossary#reference-architectures
Reflexive Security,"Reflexive Security is an approach for information security management built upon the principles of Agile and DevOps. It is a non-prescriptive framework that is purely needs-based, emphasizes collective responsibility, and considers information security and its responses to be a holistic function of the organization.","Reflexive Security emphasizes security across organizational roles that reacts to external and internal threats in an agile and dynamic way. It aims to be a new information security management strategy that is dynamic, interactive, effective and holistic. | As defined in ISO 27000 and Information Security Management through Reflexive Security : CSA .",https://cloudsecurityalliance.org/cloud-security-glossary#reflexive-security
Registry Services,Registry services catalog services available within the IT infrastructure and the metadata around how they should be accessed.,Enterprise Architecture Reference Guide v2 : CSA : Technology Solution Services (TSS) Domain - Information Services,https://cloudsecurityalliance.org/cloud-security-glossary#registry-services
Rehosting (Lift & Shift),"applications are moved to the cloud with minimal changes, retaining the existing architecture, it is the fastest migration approach but the least optimized for the cloud. In terms of security considerations, existing security controls and issues may not effectively transfer to the cloud due to architectural differences.",https://docs.aws.amazon.com/prescriptive-guidance/latest/large-migration-guide/migration-strategies.html,https://cloudsecurityalliance.org/cloud-security-glossary#rehosting-lift-shift
Release Management,"The release management architecture is the set of conceptual patterns that support the movement of pre-production technical resources into production. Pre-production includes all the activities that are necessary to prove that a particular resource is appropriate for the technical, business, and operational environment and does not exceed a risk profile for a particular task. Significant release management patterns include those for release scheduling, release acceptance, and audit. Release management plays a vital role both as a process and as a set of technologies and it provides a vital control point for request, change, and configuration management processes and architectures.",Enterprise Architecture Reference Guide v2 : CSA : Information Technology Operation & Support (ITOS) Domain,https://cloudsecurityalliance.org/cloud-security-glossary#release-management
Relying party (RP),A service that relies on an identity provider (IdP) to verify a user’s identity and access rights and then grants entitlements to its own resources. Sometimes referred to as Service Provider.,https://csrc.nist.gov/glossary/term/relying_party,https://cloudsecurityalliance.org/cloud-security-glossary#relying-party-rp
Remediation,"This capability is focused on projects that are remediating existing gaps, or findings that affect the enterprise. A remediation dashboard is recommended to be used to track progress for senior management.",Enterprise Architecture Reference Guide v2 : CSA : Information Technology Operation & Support (ITOS) Domain,https://cloudsecurityalliance.org/cloud-security-glossary#remediation
Remote,A virtual machine that is delivered over the network as opposed to being installed locally on a device.,Enterprise Architecture Reference Guide v2 : CSA : Technology Solution Services (TSS) Domain - Infrastructure Services,https://cloudsecurityalliance.org/cloud-security-glossary#remote
Reportable Incidents,Incidents deemed to have a significant enough impact that they need to be reported outside the entity according to laws or regulations.,Cloud Penetration Testing : CSA,https://cloudsecurityalliance.org/cloud-security-glossary#reportable-incidents
Reporting Services,"Reporting services provide the ability to present data in various ways going from a top-level aggregated dashboard, drilling down to raw data. Reporting services also offer the ability to mine and analyze data and provide business intelligence to decision-makers",Enterprise Architecture Reference Guide v2 : CSA : Technology Solution Services (TSS) Domain - Information Services,https://cloudsecurityalliance.org/cloud-security-glossary#reporting-services
Reporting Tools,"Reporting tools provide end-users with the ability to generate reports, share reports with other users, and analyze the information domain’s data.",Enterprise Architecture Reference Guide v2 : CSA : Technology Solution Services (TSS) Domain - Information Services,https://cloudsecurityalliance.org/cloud-security-glossary#reporting-tools
Repudiation,"Creating a situation of dispute, lack or compromise of the authenticity of a record or data. In cloud testing repudiation often takes the form of deleting or turning off cloud logs or leveraging cloud services and mechanisms to mask an action or occurrence.",Cloud Penetration Testing : CSA,https://cloudsecurityalliance.org/cloud-security-glossary#repudiation
Residual Risk Management,Analysis and plans for remediating information security risk that remains after the theoretical or applied implementation of mitigating controls with the intent of increasing control effectiveness and ultimately reducing risk to an acceptable level.,Enterprise Architecture Reference Guide v2 : CSA : Security and Risk Management (SRM) Domain,https://cloudsecurityalliance.org/cloud-security-glossary#residual-risk-management
Resiliency Analysis,"The process that assesses the ability of an organization to continue to deliver services despite the occurrence of various events (e.g., loss of power, loss of network connectivity, etc.).",Enterprise Architecture Reference Guide v2 : CSA : Information Technology Operation & Support (ITOS) Domain,https://cloudsecurityalliance.org/cloud-security-glossary#resiliency-analysis
Resource logs,"For resources like VMs, databases, and software-defined networks that record every operation and change. These include events, such as resource provisioning, configuration changes, data access and transfers, and system-level activities. They provide insight into operations that were performed within the resource. The content of resource logs varies by service and resource type.",https://learn.microsoft.com/en-us/azure/azure-monitor/data-sources,https://cloudsecurityalliance.org/cloud-security-glossary#resource-logs
Resource pooling,"Cloud computing pools various physical and virtual resources to serve multiple CSCs using a multi-tenant model. These resources, like storage, processors, memory, and network bandwidth, are dynamically assigned and reassigned according to demand.",https://csrc.nist.gov/glossary/term/resource_pooling,https://cloudsecurityalliance.org/cloud-security-glossary#resource-pooling
Resource Data Management,Authorization plays a key role in data management by simultaneously providing access and protection to application information resources.,Enterprise Architecture Reference Guide v2 : CSA : Security and Risk Management (SRM) Domain,https://cloudsecurityalliance.org/cloud-security-glossary#resource-data-management
Resource Management,"Resource management deals with the accurate assignment of resources to IT service delivery functions. It is considered a sharable service, separate from project management since the same patterns can be applied to solve operational, production, and emergency resource allocations. Resource management includes technologies that assist in resource pooling, forecasting, and leveling. Other resource management functions are more strictly related to solutions for Human Resources management. This service does provide valuable input into the BOSS Domain for costing, forecasting, and planning activities.",Enterprise Architecture Reference Guide v2 : CSA : Information Technology Operation & Support (ITOS) Domain,https://cloudsecurityalliance.org/cloud-security-glossary#resource-management
Resource Protection,Prevention of misuse of computer resources.,Enterprise Architecture Reference Guide v2 : CSA : Security and Risk Management (SRM) Domain,https://cloudsecurityalliance.org/cloud-security-glossary#resource-protection
Resource portal-based deployment,"In this deployment model, the PEP is a single component that acts as a gateway for subject requests. The gateway portal can be for an individual resource or a secure enclave for a collection of resources used for a single business function.",https://csrc.nist.gov/publications/detail/sp/1800-35/draft,https://cloudsecurityalliance.org/cloud-security-glossary#resource-portal-based-deployment
"Responsible, Accountable, Consulted, and Informed (RACI) chart","A RACI chart (RACI matrix) clarifies roles and responsibilities, making sure that nothing falls through the cracks. RACI charts also prevent confusion by assigning clear ownership for tasks and decisions.",https://racichart.org/,https://cloudsecurityalliance.org/cloud-security-glossary#responsible-accountable-consulted-and-informed-raci-chart
Ring-LWE (RLWE) problem,This is a variant of the Learning with Errors (LWE) problem in which the (noisy) linear system to be solved is structured [LPR].,"[LPR] V. Lyubashevsky, C. Peikert and Oded Regev. On Ideal Lattices and Learning with Errors over Rings. J. ACM, 2013.",https://cloudsecurityalliance.org/cloud-security-glossary#ring-lwe-rlwe-problem
Risk,"A subset of “business risks” and, as such, should be talked about in business terms. Instead of defining risk in technical terms, cybersecurity professionals—when speaking to executives—can adopt the definition of risk used by almost every business manager and board of directors: the potential for monetary loss. In this context, “risk” is the possibility that an event will lead to reduced profitability. Therefore, a cyber event causing damage to an organization’s brand or reputation can be quantified.","Information Technology Governance, Risk and Compliance in Healthcare : CSA",https://cloudsecurityalliance.org/cloud-security-glossary#risk
Risk Classification,"In a cloud deployment registry, risk criteria captures the risk level of each environment to align with the CSC’s risk management strategy. This helps prioritize resources and efforts for risk mitigation and ensures that the appropriate level of security controls is implemented.",https://www.isaca.org/resources/glossary#glossr,https://cloudsecurityalliance.org/cloud-security-glossary#risk-classification
Risk Scoring,"A method where each entity and action is assigned a risk score based on a range of attributes, such as the IP address or time of the action. These scores are then input into a policy engine that permits or denies actions—not solely based on preset entitlements but on whether the risk level is acceptable for a given situation.",https://csrc.nist.gov/presentations/2021/nist-cyber-risk-scoring-crs-program-overview,https://cloudsecurityalliance.org/cloud-security-glossary#risk-scoring
Risk Treatment,"Risk Treatment involves selecting and implementing measures to mitigate, transfer, accept, or avoid identified risks. This process is part of a broader risk management strategy and aims to reduce the potential impact of risks to an acceptable level. Organizations choose appropriate risk treatment options based on their risk appetite and the effectiveness of available controls.",https://www.isaca.org/resources/glossary#glossr,https://cloudsecurityalliance.org/cloud-security-glossary#risk-treatment
Risk Acceptance,Risk acceptance is a strategy in which the company accepts the potential consequences of a given risk.,https://www.sciencedirect.com/topics/computer-science/risk-acceptance,https://cloudsecurityalliance.org/cloud-security-glossary#risk-acceptance
Risk Appetite,"The tolerance level organizations have for risk. One aspect of this is understanding how much risk an organization is willing to tolerate, while another is thinking about how much an organization is willing to invest or spend to manage the risk.","Information Technology Governance, Risk and Compliance in Healthcare : CSA",https://cloudsecurityalliance.org/cloud-security-glossary#risk-appetite
Risk Assessments,"Risk Assessments measure the maturity of the organization’s controls from a reference framework perspective (i.e., COBIT, ISO27001), regulatory perspective (i.e., SOX, PCI).",Enterprise Architecture Reference Guide v2 : CSA : Technology Solution Services (TSS) Domain - Information Services,https://cloudsecurityalliance.org/cloud-security-glossary#risk-assessments
Risk Avoidance,1. Course of action that removes a risk factor from further consideration 2. A risk response strategy whereby the project team acts to eliminate the threat or protect the project from its impact [A Guide to the Project Management Body of Knowledge (PMBOK® Guide) — Fifth Edition],https://www.iso.org/obp/ui#iso:std:iso-iec-ieee:24765:ed-2:v1:en:term:3.3517,https://cloudsecurityalliance.org/cloud-security-glossary#risk-avoidance
Risk Based Authentication,"A non-static authentication system which takes into account the profile(IP address, User-Agent HTTP header, time of access, and so on) of the agent requesting access to the system to determine the risk profile associated with that transaction. The risk profile is then used to determine the complexity of the challenge. Higher risk profiles leads to stronger challenges, whereas a static username/password may suffice for lower-risk profiles. Risk-based implementation allows the application to challenge the user for additional credentials only when the risk level is appropriate",Enterprise Architecture Reference Guide v2 : CSA : Security and Risk Management (SRM) Domain,https://cloudsecurityalliance.org/cloud-security-glossary#risk-based-authentication
Risk Dashboard,"Graphically measure and report the level of potential, inherent, and residual risks and the effectiveness of controls to help the organization understand threats and vulnerabilities and make risk-based decisions to maintain or improve control effectiveness.",Enterprise Architecture Reference Guide v2 : CSA : Security and Risk Management (SRM) Domain,https://cloudsecurityalliance.org/cloud-security-glossary#risk-dashboard
Risk Management,"Risk management is the identification, assessment, and prioritization of risks followed by coordinated and economical application of resources to minimize, monitor, and control the probability and/or impact of unfortunate events.",Enterprise Architecture Reference Guide v2 : CSA : Technology Solution Services (TSS) Domain - Information Services,https://cloudsecurityalliance.org/cloud-security-glossary#risk-management
Risk Management Framework,Ensures that a repeatable process is defined and documented that is workable within the business. The risk management framework must be used within the business context for which it is defined.,Enterprise Architecture Reference Guide v2 : CSA : Business Operation Support Services (BOSS) Domain,https://cloudsecurityalliance.org/cloud-security-glossary#risk-management-framework
Risk Mitigation,"Prioritizing, evaluating, and implementing the appropriate risk-reducing controls/countermeasures recommended from the risk management process.",https://csrc.nist.gov/glossary/term/risk_mitigation,https://cloudsecurityalliance.org/cloud-security-glossary#risk-mitigation
Risk Portfolio Management,"An articulation of the Information Security Program’s scope and charter includes, for example, such focus areas as reputation, corporate governance and regulation, corporate social responsibility, and information assurance. The portfolio can change as necessary to remain consistent with the business objectives and to remain relevant and responsive to a changing threat landscape and evolving laws and regulations.",Enterprise Architecture Reference Guide v2 : CSA : Security and Risk Management (SRM) Domain,https://cloudsecurityalliance.org/cloud-security-glossary#risk-portfolio-management
Risk Taxonomy,"A taxonomy to identify, capture, and classify known threats. One example used in the SABSA threat modeling framework defines threat domains (people, processes, systems, external events) and threat categories based on experience and observation.",Enterprise Architecture Reference Guide v2 : CSA : Security and Risk Management (SRM) Domain,https://cloudsecurityalliance.org/cloud-security-glossary#risk-taxonomy
Risk Tolerance,The level of risk or degree of uncertainty acceptable to organizations. An organization’s risk tolerance level is the amount of data and systems that can be risked to an acceptable level.,"Information Technology Governance, Risk and Compliance in Healthcare : CSA",https://cloudsecurityalliance.org/cloud-security-glossary#risk-tolerance
Risk Transfer,"Risk transference is where the exposure to the risk is transferred to a third party, usually as part of a financial transaction.",https://www.sciencedirect.com/topics/computer-science/risk-transference,https://cloudsecurityalliance.org/cloud-security-glossary#risk-transfer
Rivest-Shamir-Adleman (RSA),A public-key algorithm that is used for key establishment and the generation and verification of digital signatures.,https://nvlpubs.nist.gov/nistpubs/SpecialPublications/NIST.SP.800-175Br1.pdf,https://cloudsecurityalliance.org/cloud-security-glossary#rivest-shamir-adleman-rsa
Roadmap,"Strategic direction and plans for changes to capabilities and solutions within the technology portfolio (including the security roadmap) to accomplish a desired future state (e.g., continuous innovation, integration of capabilities, etc.). This process must be aligned with the business strategy).",Enterprise Architecture Reference Guide v2 : CSA : Information Technology Operation & Support (ITOS) Domain,https://cloudsecurityalliance.org/cloud-security-glossary#roadmap
Role,"Provides a permission-centric view, defining the access level for users to perform specific tasks. Roles can be unique or shared. A single user might have multiple roles depending on their responsibilities. Conversely, multiple users can share the same role if they have the same access needs.",https://csrc.nist.gov/glossary/term/role,https://cloudsecurityalliance.org/cloud-security-glossary#role
