term,definition,sources,source_anchor
Data Breach Prevention,"Data Breach Prevention is the practice of implementing security measures and strategies to avoid unauthorized access or disclosure of sensitive information. This is important in the IAM domain to protect the confidentiality, integrity, and availability of data. Data Breach Prevention includes implementing access controls, monitoring user activities, regularly updating security policies, and ensuring that all security systems are up to date. For example, an organization may deploy multifactor authentication and data encryption to protect data from unauthorized access.",,https://cloudsecurityalliance.org/cloud-security-glossary#data-breach-prevention
Data Classification,"The process to describe data’s business value to separate it into categories such as public, private, secret, to guide data handling procedures.",Enterprise Architecture Reference Guide v2 : CSA : Technology Solution Services (TSS) Domain - Information Services,https://cloudsecurityalliance.org/cloud-security-glossary#data-classification
Data De-Identification,"The process for removing identifying information from datasets, most commonly to protect the privacy of individuals, by using methods such as data masking. Data de-identification may also be used to protect organizations, such as businesses included in statistical surveys, or other information such as the spatial location of mineral or archaeological finds or endangered species.",Enterprise Architecture Reference Guide v2 : CSA : Security and Risk Management (SRM) Domain,https://cloudsecurityalliance.org/cloud-security-glossary#data-de-identification
Data Discovery,"Scanning and classifying data held in Network, Endpoint, and Server.",Enterprise Architecture Reference Guide v2 : CSA : Security and Risk Management (SRM) Domain,https://cloudsecurityalliance.org/cloud-security-glossary#data-discovery
Data Governance,"As the organization manages data between Applications, Services, and Enterprise Information Integration activities, the need to have a well define governance model that outlines and looks for compliance on how data is massaged, transformed, and stored throughout the IT infrastructure including internal and external services (i.e., SaaS, PaaS, IaaS, ASP, or others).","Processes included in data governance include data ownership, how data should be classified, and responsibilities that data/ asset owners have for their applications and services, and the necessary controls for data throughout the lifecycle. | Enterprise Architecture Reference Guide v2 : CSA : Business Operation Support Services (BOSS) Domain",https://cloudsecurityalliance.org/cloud-security-glossary#data-governance
Data Historian,A centralized database located in the control system LAN supporting data archival and data analysis using statistical process control techniques.,https://www.us-cert.gov/ics/Control_System_Historian-Definition.html,https://cloudsecurityalliance.org/cloud-security-glossary#data-historian
Data Life Cycle Management,"The Data Life Cycle Management covers the following six phases: create, store, use, share, archive, and destroy. Although it is shown as a linear progression, once created, data may flow between stages without restriction, and may not pass through all stages during usefulness.",Enterprise Architecture Reference Guide v2 : CSA : Security and Risk Management (SRM) Domain,https://cloudsecurityalliance.org/cloud-security-glossary#data-life-cycle-management
Data Loss Prevention (DLP),"DLP refers to systems that enforce policies to safeguard critical data such as Intellectual Property and customer information and ensure it doesn’t escape from the enterprise to unintended parties. These solutions discover and classify sensitive data, define and manage policies based on content and context, monitor and enforce movement of data, as well as report, audit, and document incidents of data leakage.",Enterprise Architecture Reference Guide v2 : CSA : Security and Risk Management (SRM) Domain,https://cloudsecurityalliance.org/cloud-security-glossary#data-loss-prevention-dlp
Data Masking,The process of obscuring (masking) specific data elements within data stores. It ensures that sensitive data is replaced with realistic but not real data. The goal is that sensitive data are not available outside of the authorized environment.,Enterprise Architecture Reference Guide v2 : CSA : Security and Risk Management (SRM) Domain,https://cloudsecurityalliance.org/cloud-security-glossary#data-masking
Data Mining,"Data mining is the ability to drill-down on KPIs and KQIs in order to find the underlying root cause for the indicators’ results. The actual data mining task can be an automatic or semi-automatic analysis of large quantities of data to extract previously unknown interesting patterns such as groups of data records (cluster analysis), unusual records (anomaly detection), and dependencies (association rule mining). These patterns can then be seen as a kind of summary of the input data and used in further analysis or, for example, in machine learning and predictive analytics. For example, the data mining step might identify multiple groups in the data, which can then be used to obtain more accurate prediction results by a decision support system.",Enterprise Architecture Reference Guide v2 : CSA : Technology Solution Services (TSS) Domain - Information Services,https://cloudsecurityalliance.org/cloud-security-glossary#data-mining
Data Obscuring,"A method of protecting fields or records of data by some form of obfuscation such as encryption. Data obscuring techniques can be used in source code, for example, to prevent reverse engineering of applications. There are also low tech solutions such as ink stamps to redact sensitive information on hard copies.",Enterprise Architecture Reference Guide v2 : CSA : Security and Risk Management (SRM) Domain,https://cloudsecurityalliance.org/cloud-security-glossary#data-obscuring
Data Ownership / Stewardship,"This capability manages the communications, responsibilities, and associated processes for personnel that interacts with data throughout its lifecycle. Roles associated with the data interaction include Data Owners, Asset Custodians, Data Users, Supporting Services, and Delegates.",Enterprise Architecture Reference Guide v2 : CSA : Business Operation Support Services (BOSS) Domain,https://cloudsecurityalliance.org/cloud-security-glossary#data-ownership-stewardship
Data Plane,Used for communication between software components. This communication channel may not be possible before the path has been established via the control plane.,SDP architectures separate the control of connections from the actual connections used to transfer data called the ‘data plane’. The data plane consists of two-way encrypted connections typically using mutual TLS or another mutual authentication mechanism. | https://nvlpubs.nist.gov/nistpubs/SpecialPublications/NIST.SP.800-207.pdf | https://downloads.cloudsecurityalliance.org/assets/research/sdp/SDP-glossary.pdf,https://cloudsecurityalliance.org/cloud-security-glossary#data-plane
Data Protection,"In the information age, data is an asset. However, most data is valuable only if it is protected. Data protection needs to cover all data lifecycle stages, data types, and data states. Data stages include create, store, access, roam, share, and retire. Data types include unstructured data such as word processing documents, structured data such as data within databases, and semi-structured data such as emails. Data states include data at rest (DAR), data in transit (DIT) (aka data in motion, data in flight), and data in use (DIU). Data Protection controls include data lifecycle management, data loss prevention, intellectual property protection with digital rights management, and cryptographic services such as key management and PKI/symmetric encryption.",Enterprise Architecture Reference Guide v2 : CSA : Security and Risk Management (SRM) Domain,https://cloudsecurityalliance.org/cloud-security-glossary#data-protection
Data Protection Addendum (DPA),"A DPA consists of regulatory requirements stating data security and processing terms, including disclosure, security incident notification, data transfers, use of subprocessors, and compliance with data privacy regimes (e.g., GDPR, CCPA). DPAs are good practice for any organization to eliminate ambiguity with respect to organization data handling.",Recommendations for Adopting a Cloud-Native Key Management Service with an External Key Origin : CSA,https://cloudsecurityalliance.org/cloud-security-glossary#data-protection-addendum-dpa
Data Seeding,"A way of detecting and tracking data scraping, plagiarism, and theft is to seed the data with either easily identifiable items to trace where the data ends up or with bogus records to destroy the value of the data. For example, by inserting a record in a phone number database with an odd name, the true originator/owner could identify that bogus record if it appears in a competitor’s database.",Enterprise Architecture Reference Guide v2 : CSA : Security and Risk Management (SRM) Domain,https://cloudsecurityalliance.org/cloud-security-glossary#data-seeding
Data Segregation,"Data segregation is the process and controls that ensure data is segregated in a multi-tenant environment, so each tenant has access to his and only his data",Enterprise Architecture Reference Guide v2 : CSA : Technology Solution Services (TSS) Domain - Information Services,https://cloudsecurityalliance.org/cloud-security-glossary#data-segregation
Data Tagging,A data tag is a keyword or term assigned typically as a form of metadata to a piece of information. It helps describe an item and facilitates it being found again by browsing or searching.,Enterprise Architecture Reference Guide v2 : CSA : Security and Risk Management (SRM) Domain,https://cloudsecurityalliance.org/cloud-security-glossary#data-tagging
"Data at Rest Encryption (DB, File, SAN, Desktop, Mobile)",Encryption of “Data at Rest” (data recorded on storage media).,Enterprise Architecture Reference Guide v2 : CSA : Security and Risk Management (SRM) Domain,https://cloudsecurityalliance.org/cloud-security-glossary#data-at-rest-encryption-db-file-san-desktop-mobile
"Data in Transit Encryption (Transitory, Fixed)",Encryption of “Data in Transit” (data being transferred between two nodes in a network).,Enterprise Architecture Reference Guide v2 : CSA : Security and Risk Management (SRM) Domain,https://cloudsecurityalliance.org/cloud-security-glossary#data-in-transit-encryption-transitory-fixed
Data in Use Encryption (Memory),"Encryption of “Data in Use” (data in resident memory, or swap, or processor cache or disk cache, etc.).",Enterprise Architecture Reference Guide v2 : CSA : Security and Risk Management (SRM) Domain,https://cloudsecurityalliance.org/cloud-security-glossary#data-in-use-encryption-memory
"Data, Applications, Assets, and Services (DAAS)","Data, Applications, Assets, and Services (DAAS) encompass the critical components that organizations must protect to ensure operational continuity and security. This includes sensitive data, software applications, physical and virtual assets, and essential services that support business functions.",https://www.nccoe.nist.gov/sites/default/files/2022-12/zta-nist-sp-1800-35a-preliminary-draft-2.pdf,https://cloudsecurityalliance.org/cloud-security-glossary#data-applications-assets-and-services-daas
Database Storage,"With respect to cloud-based storage, services that offer relational and non-relational databases that are highly scalable and can handle large amounts of unstructured data",https://nvlpubs.nist.gov/nistpubs/SpecialPublications/NIST.SP.800-209.pdf,https://cloudsecurityalliance.org/cloud-security-glossary#database-storage
Database as a Service (DBaaS),"With respect to cloud-based database solutions, when DBaaS is used, the CSP provides the database capability and the customer configures and manages the database",https://www.ibm.com/topics/dbaas,https://cloudsecurityalliance.org/cloud-security-glossary#database-as-a-service-dbaas
Database Events,"Events regarding activity within the database management systems including logins, transactions, and administrative changes.",Enterprise Architecture Reference Guide v2 : CSA : Technology Solution Services (TSS) Domain - Information Services,https://cloudsecurityalliance.org/cloud-security-glossary#database-events
Database Monitoring,"This capability is a collection of database management system related events, including logins, queries, transactions, and administrative activity.",Enterprise Architecture Reference Guide v2 : CSA : Business Operation Support Services (BOSS) Domain,https://cloudsecurityalliance.org/cloud-security-glossary#database-monitoring
Database Virtualization,"Database virtualization is the decoupling of the database layer, which lies between the storage and application layers within the application stack. Virtualization at the database layer allows hardware resources to be extended to allow for better sharing resources between applications and users, masking of the physical location and configuration of a database from querying programs, as well as enable more scalable computing.",Enterprise Architecture Reference Guide v2 : CSA : Technology Solution Services (TSS) Domain - Infrastructure Services,https://cloudsecurityalliance.org/cloud-security-glossary#database-virtualization
Databases (DBs),"Compliance testing against a collection of data that is organized so that its contents can easily be accessed, managed, and updated.",Enterprise Architecture Reference Guide v2 : CSA : Security and Risk Management (SRM) Domain,https://cloudsecurityalliance.org/cloud-security-glossary#databases-dbs
Deepfake,"Falsified or faked media generated with a machine-learning system, specifically a deep neural network.",https://www.unite.ai/what-are-deepfakes/,https://cloudsecurityalliance.org/cloud-security-glossary#deepfake
Default-drop Firewalls,Also known as: Drop-all Firewalls,"The system should drop all TCP and UDP packets and not respond to those attempts, providing no information to potential attackers that the port is being monitored. After authentication and authorization, the user is granted access to the service. | https://s3.amazonaws.com/content-production.cloudsecurityalliance/78LUxxzkrWjbh625ALBt1jk9?response-content-disposition=inline%3B%20filename%3D%22SDP_Architecture_Guide_Web.pdf%22%3B%20filename%2A%3DUTF-8%27%27SDP_Architecture_Guide_Web.pdf&response-content-type=application%2Fpdf&X-Amz-Algorithm=AWS4-HMAC-SHA256&X-Amz-Credential=AKIAS6XDIRHKHO4F5SU4%2F20220906%2Fus-east-1%2Fs3%2Faws4_request&X-Amz-Date=20220906T182512Z&X-Amz-Expires=300&X-Amz-SignedHeaders=host&X-Amz-Signature=3633d75a35c372f801c17a446ce92851ea411fb4a5ae988166a988693d4b06c3",https://cloudsecurityalliance.org/cloud-security-glossary#default-drop-firewalls
Defense-in-Depth,"Information security strategy integrating people, technology, and operations capabilities to establish variable barriers across multiple layers and missions of the organization.",https://nvlpubs.nist.gov/nistpubs/SpecialPublications/NIST.SP.800-53r5.pdf,https://cloudsecurityalliance.org/cloud-security-glossary#defense-in-depth
Denial of Service (DoS),"The act of making a system, feature or resource unavailable for intended users. In cloud testing, denial of service often takes the form of destruction or encryption of cloud resources, disablement of accounts, credentials or users.",Cloud Penetration Testing : CSA,https://cloudsecurityalliance.org/cloud-security-glossary#denial-of-service-dos
Deployment,"With respect to cloud deployments, an isolated environment within a cloud provider analogous to an AWS Account, an Azure Subscription, or a GCP Project.",https://nvlpubs.nist.gov/nistpubs/legacy/sp/nistspecialpublication800-145.pdf,https://cloudsecurityalliance.org/cloud-security-glossary#deployment
Deprovisioning,"Deprovisioning refers to the process of revoking access to resources when an employee or contractor leaves an organization or their role changes. This is a critical component of the IAM domain, as it ensures that former employees do not have access to sensitive information. Deprovisioning may involve disabling accounts, revoking permissions, and removing any associated digital certificates or keys. For instance, when an employee leaves an organization, their account should be deactivated, and access to their credentials should be revoked to prevent unauthorized access.",,https://cloudsecurityalliance.org/cloud-security-glossary#deprovisioning
Design patterns,"reusable solutions to particular problems. In security, an example is IaaS log management. As with reference architectures, they can be more or less abstract or specific, even down to common implementation patterns on particular cloud platforms.",https://www.cs.ubc.ca/~gregor/teaching/papers/4+1view-architecture.pdf,https://cloudsecurityalliance.org/cloud-security-glossary#design-patterns
Desktop 'Client' Virtualization,"Concerned with how virtual instances of the traditional desktop are created, presented and managed.",Enterprise Architecture Reference Guide v2 : CSA : Technology Solution Services (TSS) Domain - Infrastructure Services,https://cloudsecurityalliance.org/cloud-security-glossary#desktop-client-virtualization
Desktops,"Desktops are the classic computer that typically sits on or under a desktop and includes a CPU, monitor, keyboard, mouse, and other peripheral devices.",Enterprise Architecture Reference Guide v2 : CSA : Technology Solution Services (TSS) Domain,https://cloudsecurityalliance.org/cloud-security-glossary#desktops
DevOps,Application of software development methodologies to infrastructure operations.,As defined in ISO 27000 and Information Security Management through Reflexive Security : CSA .,https://cloudsecurityalliance.org/cloud-security-glossary#devops
DevOps Research and Assessments (DORA) Metrics,"Four key metrics that indicate the performance of software development teams. The metrics are focused on deployment frequency, lead time for changes, change failure rate, and time to restore service.",https://docs.gitlab.com/ee/user/analytics/dora_metrics.html,https://cloudsecurityalliance.org/cloud-security-glossary#devops-research-and-assessments-dora-metrics
DevSecOps (DSO),"The integration of continuous security principles, processes, and technologies into DevOps culture, practices, and workflows.",As defined in ISO 27000 and Information Security Management through Reflexive Security : CSA .,https://cloudsecurityalliance.org/cloud-security-glossary#devsecops-dso
Developer,"A business or technology professional that builds software programs; a computer programmer (syn.) can refer to a specialist in one area of computers, or to a generalist who writes code for many kinds of software in one or more computer programming languages.","Wikipedia contributors. (2021b, August 7). Programmer. Wikipedia. https://en.wikipedia.org/wiki/ Programmer",https://cloudsecurityalliance.org/cloud-security-glossary#developer
Development Process,The Development Process must address security concerns while the solution is being built using tools like source code scanners that can locate common security flaws in the code and web application vulnerability scanners that can test if a web application can be manipulated with common techniques used by hackers.,Enterprise Architecture Reference Guide v2 : CSA : Technology Solution Services (TSS) Domain - Application Services,https://cloudsecurityalliance.org/cloud-security-glossary#development-process
Device Attestation,"The ability to provide proof that elements of the device (e.g., firmware) have not been tampered with.","SDPs should include a mechanism to prove that the proper device holds the private key and that the software running on the device can be trusted. Device attributes and contents (e.g. files, registry keys) may be used to validate the device. | https://nvlpubs.nist.gov/nistpubs/CSWP/NIST.CSWP.09082020-draft.pdf | https://downloads.cloudsecurityalliance.org/assets/research/sdp/SDP-glossary.pdf",https://cloudsecurityalliance.org/cloud-security-glossary#device-attestation
Device Onboarding Process,Involves the installation of the physical device and the setup of credentials so that it can securely communicate with its target cloud or platform.,"Device onboarding for SDP entails the process of including new devices such as mobile phones, servers, and other IoT elements into an SDP. | https://media.fidoalliance.org/wp-content/uploads/2021/04/Introduction-to-FIDO-Device-Onboard-1.pdf | https://downloads.cloudsecurityalliance.org/assets/research/sdp/SDP-glossary.pdf",https://cloudsecurityalliance.org/cloud-security-glossary#device-onboarding-process
Device agent / gateway-based deployment,"In this deployment model, the PEP is divided into two components that reside on the resource or as a component directly in front of a resource.",https://csrc.nist.gov/publications/detail/sp/1800-35/draft,https://cloudsecurityalliance.org/cloud-security-glossary#device-agent-gateway-based-deployment
Device application sandboxing,"Another variation of the agent/gateway deployment model is having vetted applications or processes run compartmentalized on assets. These compartments could be virtual machines, containers, or some other implementation, but the goal is the same: to protect the application or instances of applications from a possibly compromised host or other applications running on the asset.",https://csrc.nist.gov/publications/detail/sp/1800-35/draft,https://cloudsecurityalliance.org/cloud-security-glossary#device-application-sandboxing
Digital Certificate,"A Digital Certificate is an electronic document that verifies the identity of an entity and is used to establish secure communication between parties. In the IAM domain, digital certificates are commonly used for authentication and encryption purposes. They are issued by a trusted third party called a Certificate Authority (CA). For example, an organization may use digital certificates to authenticate the identity of employees accessing the network remotely or to encrypt sensitive data transmitted over the internet.",,https://cloudsecurityalliance.org/cloud-security-glossary#digital-certificate
Digital Rights Management,"DRM is a term for access control technologies used by hardware manufacturers, publishers, copyright holders, enterprises, and individuals to limit the use of digital content and devices. The term has taken on at least two meanings. One refers to technology supporting the 1998 Digital Millennium Copyright Act to protect copyrighted media, maintain royalties, and ensure artistic control. The other definition applies to enterprise rights management technologies that attempt to put security controls closer to the enterprise data itself, often in encryption and metadata that carry access control information.",Enterprise Architecture Reference Guide v2 : CSA : Security and Risk Management (SRM) Domain,https://cloudsecurityalliance.org/cloud-security-glossary#digital-rights-management
Directory Service,"A Directory Service is a centralized database that stores and manages user and device identities and their attributes, such as access permissions, roles, and credentials. It is used to simplify and streamline user authentication and authorization in the IAM domain. For example, an organization may use a directory service such as Microsoft Active Directory to manage user identities and access permissions across multiple systems.",,https://cloudsecurityalliance.org/cloud-security-glossary#directory-service
Directory Traversal,"A directory traversal occurs when you are able to traverse out of the current directory into parent directories, usually by supplying a series of “../” (dot dot slashes). Typically, directory traversal attacks allow the attacker to access or overwrite files that are not intended to be accessible.",https://www.sciencedirect.com/topics/computer-science/directory-traversal,https://cloudsecurityalliance.org/cloud-security-glossary#directory-traversal
Disaster Recovery as a Service (DRaaS),A cloud computing service model that allows an organization to back up its data and IT infrastructure in a third-party cloud computing environment from which it is possible to regain access and functionality to IT infrastructure after a disaster.,Disaster Recovery as a Service : CSA,https://cloudsecurityalliance.org/cloud-security-glossary#disaster-recovery-as-a-service-draas
Discriminative Model,"Learn about the boundary between classes within a dataset, with the goal to identify the decision boundary between classes to apply reliable class labels to data instances. Discriminative models separate the classes in the dataset by using conditional probability, not making any assumptions about individual data points.",https://www.unite.ai/generative-vs-discriminative-machine-learning-models/,https://cloudsecurityalliance.org/cloud-security-glossary#discriminative-model
Distributed Denial-of-Service (DDoS),Involves multiple computing devices in disparate locations sending repeated requests to a server with the intent to overload it and ultimately render it inaccessible.,https://nvlpubs.nist.gov/nistpubs/SpecialPublications/NIST.SP.1800-15.pdf,https://cloudsecurityalliance.org/cloud-security-glossary#distributed-denial-of-service-ddos
