term,definition,sources,source_anchor
Integrated Circuit Chip (ICC),The ICC is part of a smart card and is embedded into the physical plastic. Smart cards are often used in two-factor authentication solutions where the user enters a pin which is used by an operating system on the smart card to release evidence of identity such as a digital certificate or to allow a private key to sign an identity token which is sent to an enforcement agent that determines if the identity is valid.,https://ea.cloudsecurityalliance.org/display.php?id=data_sec6036&_ga=2.215953620.277413644.1656439470-2107700575.1655484199,https://cloudsecurityalliance.org/cloud-security-glossary#integrated-circuit-chip-icc
Integrated Development Environment (IDE),Set of software tools or applications to provide comprehensive facilities for software development.,https://www.iso.org/obp/ui#iso:std:iso-iec-ieee:24765:ed-2:v1:en:term:3.2029,https://cloudsecurityalliance.org/cloud-security-glossary#integrated-development-environment-ide
Integration Middleware,"Integration Middleware is a set of tools like service buses and message queues that allow applications to exchange information without talking directly. Security concerns for these services include making sure the messages being exchanged are not read or tampered with during delivery, and reliable sources are only sending them.",Enterprise Architecture Reference Guide v2 : CSA : Technology Solution Services (TSS) Domain - Application Services,https://cloudsecurityalliance.org/cloud-security-glossary#integration-middleware
Integrity Measurement Architecture (IMA),Integrity Measurement Architecture (IMA) is the accredited remote attestation methods which formulates the integrity measurement process and integrity reporting protocol.,https://ieeexplore.ieee.org/document/5557396,https://cloudsecurityalliance.org/cloud-security-glossary#integrity-measurement-architecture-ima
Intellectual Property,"A term referring to a number of distinct types of creations of the mind for which a set of exclusive rights are recognized-and the corresponding fields of law. Under intellectual property law, owners are granted certain exclusive rights to various intangible assets, such as musical, literary, and artistic works; discoveries and inventions; and words, phrases, symbols, and designs. Common types of intellectual property rights include copyrights, trademarks, patents, industrial design rights, and trade secrets in some jurisdictions.",Enterprise Architecture Reference Guide v2 : CSA : Security and Risk Management (SRM) Domain,https://cloudsecurityalliance.org/cloud-security-glossary#intellectual-property
Intellectual Property Protection,The activity (e.g. applying process or technical control) of preventing misuse and improper disclosure of intellectual property.,Enterprise Architecture Reference Guide v2 : CSA : Security and Risk Management (SRM) Domain,https://cloudsecurityalliance.org/cloud-security-glossary#intellectual-property-protection
Inter-Mediation,"An API Facade is a layer or gateway that sits between the microservices and the API exposed to external services. The facade creates a buffer or layer between the interface exposed to apps and app developers and the complex services. You may have several API’s into different microservices, the facade abstracts the complexity with a simple singular interface.",Microservices Architecture Pattern : CSA,https://cloudsecurityalliance.org/cloud-security-glossary#inter-mediation
Interactive Application Security Testing (IAST),Software component deployed with an application that assesses application behavior and detects presence of vulnerabilities on an application being exercised in realistic testing scenarios.,The Six Pillars of DevSecOps: Automation : CSA,https://cloudsecurityalliance.org/cloud-security-glossary#interactive-application-security-testing-iast
Internal,"It focuses on attacks that could be launched by an insider. In contrast to a remote attacker, this attacker may have some form of authorized access and already has access to the internal network. The insider can also have more knowledge of the location of valuable data.",Enterprise Architecture Reference Guide v2 : CSA : Security and Risk Management (SRM) Domain,https://cloudsecurityalliance.org/cloud-security-glossary#internal
Internal Identity,"Internal Identity refers to the unique identification of individuals within an organization, used to manage access to systems and resources. It ensures that only authorized personnel can access sensitive data and perform specific tasks within the organization’s IT infrastructure.",https://developer.okta.com/docs/concepts/iam-overview/,https://cloudsecurityalliance.org/cloud-security-glossary#internal-identity
Internal (VNIC),A VNIC is a virtualized network interface that presents the same media access control (MAC) interface that an actual interface would provide.,Enterprise Architecture Reference Guide v2 : CSA : Technology Solution Services (TSS) Domain - Infrastructure Services,https://cloudsecurityalliance.org/cloud-security-glossary#internal-vnic
Internal Audits,"Provides a cross-checking mechanism within the organization. In larger organizations, there is likely to be some level of independence as well.",Enterprise Architecture Reference Guide v2 : CSA : Business Operation Support Services (BOSS) Domain,https://cloudsecurityalliance.org/cloud-security-glossary#internal-audits
Internal Infrastructure,"The internal infrastructure services are mainly concerned with the physical assets used by the cloud service provider to support the virtualized services actually seen by cloud users. In many ways, these services are the lowest-level and least visible to the end cloud user though they are the foundation that underlies reliable and secure operation of the cloud service. For instance, without good facility security, there is no need for an adversary to mount a network attack on a cloud service as it is easier to just walk into the facility and unplug a server or network connection.",Enterprise Architecture Reference Guide v2 : CSA : Technology Solution Services (TSS) Domain - Infrastructure Services,https://cloudsecurityalliance.org/cloud-security-glossary#internal-infrastructure
Internal Investigations,"Internal investigations are concerned with determining the factual truth and implications of a policy or criminal investigation. This process includes fraud detection, prevention, and forensic investigation.",Enterprise Architecture Reference Guide v2 : CSA : Business Operation Support Services (BOSS) Domain,https://cloudsecurityalliance.org/cloud-security-glossary#internal-investigations
Internal SLAs,Service level agreements within an organization that codify the specific services to be delivered and the performance criteria governing that delivery.,Enterprise Architecture Reference Guide v2 : CSA : Information Technology Operation & Support (ITOS) Domain,https://cloudsecurityalliance.org/cloud-security-glossary#internal-slas
Internet Protocol Security (IPSec),"Provide(s) interoperable, high quality, cryptographically-based security for IPv4 and IPv6. The set of security services offered includes access control, connectionless integrity, data origin authentication, detection and rejection of replays (a form of partial sequence integrity), confidentiality (via encryption), and limited traffic flow confidentiality.",SDPs provide two-way secure connections over IPSec for the upper network layers. | https://csrc.nist.gov/glossary/term/ip_security | https://downloads.cloudsecurityalliance.org/assets/research/sdp/SDP-glossary.pdf,https://cloudsecurityalliance.org/cloud-security-glossary#internet-protocol-security-ipsec
Interoperability,"Interoperability refers to the ability of different systems, devices, or applications to work together seamlessly within and across organizational boundaries. This capability ensures that information and data can be exchanged and utilized effectively between various IT environments, enabling comprehensive integration and functionality across diverse platforms​",https://www.isaca.org/resources/glossary#glossi,https://cloudsecurityalliance.org/cloud-security-glossary#interoperability
Intrusion Management,"The process of using pattern recognition to detect statistically unusual events, prevent or detect intrusion attempts, and manage the incidents.",Defined Categories of Service 2011 : CSA,https://cloudsecurityalliance.org/cloud-security-glossary#intrusion-management
Inventory Control,To provide management control and accountability over the organization’s physical and digital assets. Cloud and virtualization can create a challenge in terms of attempting to inventory virtual machines in the way physical machines have traditionally been tracked.,Enterprise Architecture Reference Guide v2 : CSA : Security and Risk Management (SRM) Domain,https://cloudsecurityalliance.org/cloud-security-glossary#inventory-control
Investment Budgeting,"The planning process used to determine whether an organization’s long term investments such as new infrastructure, replacement of existing services and infrastructure, new data centers, new products or services, research, application development, security, and project deployment are worth pursuing. Usually, a cost-benefit analysis is used as part of the investment budgeting process.",Enterprise Architecture Reference Guide v2 : CSA : Information Technology Operation & Support (ITOS) Domain,https://cloudsecurityalliance.org/cloud-security-glossary#investment-budgeting
IoT Search Engine,"Internet of Things (IoT) search engine which enables you to find physical devices with embedded computing capabilities - such as webcams, home appliances, medical devices - that are connected to and can exchange data over the Internet. Two examples of IoT search engines are Thingful (https://www.thingulf.com) and Shodan (https://www.shodan.io).",Top Threats to Cloud Computing: Egregious Eleven Deep Dive : CSA,https://cloudsecurityalliance.org/cloud-security-glossary#iot-search-engine
Isogeny,This is a particular type of mapping between two elliptic curves.,Quantum Safe Security Glossary : CSA,https://cloudsecurityalliance.org/cloud-security-glossary#isogeny
Isogeny-based cryptography,This is a sub-area of quantum-safe cryptography that constructs publickey schemes whose security is dependent on the difficulty of recovering an unknown isogeny between a pair of elliptic curves. An example is the scheme of D. Jao and L. De Feo [JF].,"[JF] D. Jao and L. De Feo. Towards Quantum-Resistant Cryptosystems from Supersingular Elliptic Curve Isogenies, Post-Quantum Cryptography 2011.",https://cloudsecurityalliance.org/cloud-security-glossary#isogeny-based-cryptography
JSON Web Token (JWT),"JSON Web Token (JWT) is an open standard (RFC 7519) that defines a compact and self-contained way for securely transmitting information between parties as a JSON object. This information can be verified and trusted because it is digitally signed. JWTs can be signed using a secret (with the HMAC algorithm) or a public/private key pair using RSA or ECDSA. Although JWTs can be encrypted to also provide secrecy between parties, we will focus on signed tokens. Signed tokens can verify the integrity of the claims contained within it, while encrypted tokens hide those claims from other parties. When tokens are signed using public/private key pairs, the signature also certifies that only the party holding the private key is the one that signed it.",https://jwt.io/introduction,https://cloudsecurityalliance.org/cloud-security-glossary#json-web-token-jwt
Java Message Service (JMS),The Java messaging service (JMS) is a middlewareoriented messaging technology working according to the publish/ subscribe principle.,https://ieeexplore.ieee.org/abstract/document/1648916,https://cloudsecurityalliance.org/cloud-security-glossary#java-message-service-jms
Job Aid Guidelines,"A job aid (aka Standard Operating Procedures or Playbooks) stores information or instruction external to a user and guides them to perform a task correctly. It is used during the actual performance when the user needs to know the information or procedure. It can be consulted quickly when needed and provides specific, concise information to the user. It reduces the need for individuals to remember so much information and is an efficient method to reduce problems associated with relying strictly on recall to perform in certain situations.",Enterprise Architecture Reference Guide v2 : CSA : Security and Risk Management (SRM) Domain,https://cloudsecurityalliance.org/cloud-security-glossary#job-aid-guidelines
Job Descriptions,Clear definitions of the responsibilities of a job help to identify the data access requirements of people with that job to ensure that they only have the minimum required access.,Enterprise Architecture Reference Guide v2 : CSA : Business Operation Support Services (BOSS) Domain,https://cloudsecurityalliance.org/cloud-security-glossary#job-descriptions
Just in Time (JIT) Privileges,"privileges are requested and granted as needed. Entities use templates to access a predetermined set of privileges for specific resources during a designated time frame, like during a maintenance window. JIT access is granted if it complies with policy constraints, and it may require additional authorization. JIT can be further enhanced when integrated with risk-scoring systems.",https://www.cyberark.com/what-is/just-in-time-access/,https://cloudsecurityalliance.org/cloud-security-glossary#just-in-time-jit-privileges
Just in Time Access (JIT),"JIT access is a process of granting a level of access as fast as possible, at the time it is needed, and removed as soon as possible, after the access is no longer needed.",https://www.cyberark.com/what-is/just-in-time-access/,https://cloudsecurityalliance.org/cloud-security-glossary#just-in-time-access-jit
Just-In-Time (JIT) access,"Just-in-time (JIT) access is the capability to provide access only when needed. In these scenarios, the user requests access and is timeboxed and at the end of the time the access is removed. JIT access can be manually or automatically approved through policy actions.",Recommendations for Adopting a Cloud-Native Key Management Service : CSA,https://cloudsecurityalliance.org/cloud-security-glossary#just-in-time-jit-access
Keep-Alive Message,"The keep-alive message is sent by the initiating host (IH), accepting host (AH) or controller to indicate that it is still active.",https://downloads.cloudsecurityalliance.org/initiatives/sdp/SDP_Specification_1.0.pdf?_ga=2.222448153.38415640.1663010462-1480344219.1663010462,https://cloudsecurityalliance.org/cloud-security-glossary#keep-alive-message
Kernel,Primary (of three) components of an operating system,https://www.isaca.org/resources/glossary#glossk,https://cloudsecurityalliance.org/cloud-security-glossary#kernel
Key Control Indicators (KCI),Key Control Indicators (KCI) are metrics that help in monitoring the effectiveness of control mechanisms within an organization’s risk management framework. KCIs are used to measure how well controls are performing in mitigating identified risks and ensuring compliance with policies and procedures. They provide valuable insights into the operational health of controls and help in identifying areas that require improvement .,https://www.isaca.org/resources/isaca-journal/issues/2018/volume-4/integrating-kris-and-kpis-for-effective-technology-risk-management,https://cloudsecurityalliance.org/cloud-security-glossary#key-control-indicators-kci
Key Management Services (KMS),"Key Management Services (KMS) are systems and tools designed to manage cryptographic keys throughout their lifecycle, including generation, distribution, rotation, and revocation. KMS ensures the secure handling of keys, supporting data encryption and decryption processes while maintaining compliance with security policies.",https://www.isaca.org/resources/isaca-journal/issues/2018/volume-4/integrating-kris-and-kpis-for-effective-technology-risk-management,https://cloudsecurityalliance.org/cloud-security-glossary#key-management-services-kms
Key Management,"Key management covers the entire lifecycle of keys beginning to end including generation, communication and distribution, storage, entry, and installation, checking the validity, usage, changing the active key, archiving, destruction, an audit of key operations and usage, key backup and recovery, and emergency reserve keys.",Enterprise Architecture Reference Guide v2 : CSA : Security and Risk Management (SRM) Domain,https://cloudsecurityalliance.org/cloud-security-glossary#key-management
Key Management Interoperability Protocol (KMIP),"The KMIP establishes a single, comprehensive protocol for communication between enterprise key management servers and cryptographic clients. It addresses the critical need for a comprehensive key management protocol built into the information infrastructure so that enterprises can deploy effective unified key management for all their encryption, certificate-based device authentication, digital signature, and other cryptographic capabilities.",http://xml.coverpages.org/KMIP/KMIP-WhitePaper.pdf,https://cloudsecurityalliance.org/cloud-security-glossary#key-management-interoperability-protocol-kmip
Key Management System (KMS),"The management of cryptographic keys in a cryptosystem for data control and security with cloud services. The KMS can be native to a cloud platform, external, self-operated, or other cloud service.",Key Management in Cloud Services: Understanding Encryption’s Desired Outcomes and Limitations : CSA,https://cloudsecurityalliance.org/cloud-security-glossary#key-management-system-kms
Key Risk Indicators,Identifies what the key risks are from a management or executive level. These are the key risk factors that can affect a specific business.,Enterprise Architecture Reference Guide v2 : CSA : Business Operation Support Services (BOSS) Domain,https://cloudsecurityalliance.org/cloud-security-glossary#key-risk-indicators
Keyed-Hash Message Authentication Code (HMAC),A message authentication code that uses a cryptographic key in conjunction with a hash function. It is an integral element of the initial packet that initiates connections into the SDP.,https://nvlpubs.nist.gov/nistpubs/FIPS/NIST.FIPS.198-1.pdf | https://downloads.cloudsecurityalliance.org/assets/research/sdp/SDP-glossary.pdf,https://cloudsecurityalliance.org/cloud-security-glossary#keyed-hash-message-authentication-code-hmac
Keyloggers,A reconnaissance tool–with keylogging and screen capture functionality–used for information gathering on compromised systems.,https://attack.mitre.org/software/,https://cloudsecurityalliance.org/cloud-security-glossary#keyloggers
Keystroke / Session Logging,Methodologies for capturing a detailed record of interactions with an entity (either at the level of individual keystrokes or interactions with the entity),Enterprise Architecture Reference Guide v2 : CSA : Security and Risk Management (SRM) Domain,https://cloudsecurityalliance.org/cloud-security-glossary#keystroke-session-logging
Kill Chain for Industrial Control Systems,"In 2011, Lockheed Martin analysts Eric M. Hutchins, Michael J. Cloppert and Rohan M. Amin created the Cyber Kill Chain™ to help the decision-making process for better detecting and responding to adversary intrusions. This model was adapted from the concept of military kill chains and has been a highly successful and widely popular model for defenders in IT and enterprise networks. This model is not directly applicable to the nature of ICS-custom cyber attacks, but it serves as a great foundation and concept on which to build.",The ICS Kill Chain has 2 stages: | https://www.sans.org/reading-room/whitepapers/ICS/industrial-control-system-cyber-kill-chain-36297,https://cloudsecurityalliance.org/cloud-security-glossary#kill-chain-for-industrial-control-systems
Knowledge Base,A repository of knowledge about the organization’s infrastructure and operations to enable the Security Operations Center to respond to events efficiently.,Enterprise Architecture Reference Guide v2 : CSA : Business Operation Support Services (BOSS) Domain,https://cloudsecurityalliance.org/cloud-security-glossary#knowledge-base
Knowledge Management,"The process of organizing information and providing search capabilities such that problems and incidents can be handled quickly by referring to experience. In the Information domain, this represents the actual knowledge stored in the knowledge base regarding security FAQs, best practices, and job aids.",Enterprise Architecture Reference Guide v2 : CSA : Technology Solution Services (TSS) Domain - Information Services,https://cloudsecurityalliance.org/cloud-security-glossary#knowledge-management
Knowledge Repository,"The Knowledge Repository contains information about known patterns, processes, and procedures",Enterprise Architecture Reference Guide v2 : CSA : Technology Solution Services (TSS) Domain - Information Services,https://cloudsecurityalliance.org/cloud-security-glossary#knowledge-repository
Kubernetes,"An open-source container-orchestration system for automating deployment, scaling, and management of containerized applications across multiple hosts.",Top Threats to Cloud Computing: Egregious Eleven Deep Dive : CSA,https://cloudsecurityalliance.org/cloud-security-glossary#kubernetes
LDAP Repositories,Lightweight Directory Access Protocol (LDAP) Repositories organize users and groups of users into a hierarchical organizational structure.,Enterprise Architecture Reference Guide v2 : CSA : Technology Solution Services (TSS) Domain - Information Services,https://cloudsecurityalliance.org/cloud-security-glossary#ldap-repositories
LDM,Logical Device Manager (LDM). A Microsoft Windows capability similar in function to LVM.,Enterprise Architecture Reference Guide v2 : CSA : Technology Solution Services (TSS) Domain - Infrastructure Services,https://cloudsecurityalliance.org/cloud-security-glossary#ldm
LUN,Acronym for the SCSI protocol’s Logical Unit Number (LUN) and commonly used as a term for the block device presented to a host via a SAN.,Enterprise Architecture Reference Guide v2 : CSA : Technology Solution Services (TSS) Domain - Infrastructure Services,https://cloudsecurityalliance.org/cloud-security-glossary#lun
LVM,Logical Volume Management (LVM). Allows grouping of several physical disks into a single logical volume as viewed by the host,Enterprise Architecture Reference Guide v2 : CSA : Technology Solution Services (TSS) Domain - Infrastructure Services,https://cloudsecurityalliance.org/cloud-security-glossary#lvm
Lamport one-time signature scheme,"This is the scheme that inspired hash-based signature scheme. The technique proposed by L. Lamport [LamportRR] requires a one-way function and can be used to sign, at most, one message.","[LamportRR] L. Lamport. Constructing Digital Signatures from a One Way Function. Technical Report SRICSL-98, SRI International Computer Science Laboratory, 1979.",https://cloudsecurityalliance.org/cloud-security-glossary#lamport-one-time-signature-scheme
Large Language Model,"Advanced AI systems that leverage massive amounts of data and sophisticated algorithms to understand, interpret, and generate human language. They are primarily built using deep learning techniques, particularly neural networks, which allow them to process and learn from vast amounts of text data. The term “large” refers to both the extensive training data and the considerable size of the models, often featuring millions or even billions of parameters.",https://www.unite.ai/large-language-models/,https://cloudsecurityalliance.org/cloud-security-glossary#large-language-model
Lateral Movement,"Lateral action from a compromised internal host to strengthen the attacker foothold inside the organizational network, to control additional machines, and to eventually control strategic assets.","Cyber Weapons Report 2016, LightCyber, Ramat Gan, Israel, 2016, 14pp. http://lightcyber.com/cyber-weapons-report-network-traffic-analytics-revealsattacker-tools/ [accessed 5/11/17].",https://cloudsecurityalliance.org/cloud-security-glossary#lateral-movement
Lattice-based cryptography,"This is a sub-area of quantum-safe cryptography and includes cryptographic schemes whose security is related to the Closest Vector Problem (CVP), the Learning with Errors (LWE) problem or the Shortest Vector Problem (SVP).",Quantum Safe Security Glossary : CSA,https://cloudsecurityalliance.org/cloud-security-glossary#lattice-based-cryptography
Learning with Errors (LWE) problem,"This is a hard problem used in lattice-based cryptography. The solution to the problem, an issue introduced by O. Regev [Reg05], requires the recovery of a noisy linear equations system.","[Reg05] O. Regev. On Lattices, Learning with Errors, Random Linear Codes, and Cryptography. STOC 2005.",https://cloudsecurityalliance.org/cloud-security-glossary#learning-with-errors-lwe-problem
Least Privileged Access Control,"Least Privilege Access Control is a mechanism through which an identity is provided just enough access to a resource to carry out the work - not more / not less. For example, if a Developer needs to create resources in Development Env for his application development work, he / she will be provided to create resources only in development env (and not in test / production env). This concept is very important for enhancing the security of a system and is critical for implementing Zero Trust principles.",https://csrc.nist.gov/glossary/term/least_privilege,https://cloudsecurityalliance.org/cloud-security-glossary#least-privileged-access-control
