"article","article_name","chapter","chapter_name","content"
"14","Reporting obligations of manufacturers","II","OBLIGATIONS OF ECONOMIC OPERATORS AND PROVISIONS IN RELATION TO FREE AND OPEN-SOURCE SOFTWARE","1. A manufacturer shall notify any actively exploited vulnerability contained in the product with digital elements that it becomes aware of simultaneously to the CSIRT designated as coordinator, in accordance with paragraph 7 of this Article, and to ENISA. The manufacturer shall notify that actively exploited vulnerability via the single reporting platform established pursuant to Article 16. 2. For the purposes of the notification referred to in paragraph 1, the manufacturer shall submit: (a) an early warning notification of an actively exploited vulnerability, without undue delay and in any event within 24 hours of the manufacturer becoming aware of it, indicating, where applicable, the Member States on the territory of which the manufacturer is aware that their product with digital elements has been made available; (b) unless the relevant information has already been provided, a vulnerability notification, without undue delay and in any event within 72 hours of the manufacturer becoming aware of the actively exploited vulnerability, which shall provide general information, as available, about the product with digital elements concerned, the general nature of the exploit and of the vulnerability concerned as well as any corrective or mitigating measures taken, and corrective or mitigating measures that users can take, and which shall also indicate, where applicable, how sensitive the manufacturer considers the notified information to be; (c) unless the relevant information has already been provided, a final report, no later than 14 days after a corrective or mitigating measure is available, including at least the following: (i) a description of the vulnerability, including its severity and impact; (ii) where available, information concerning any malicious actor that has exploited or that is exploiting the vulnerability; (iii) details about the security update or other corrective measures that have been made available to remedy the vulnerability. 3. A manufacturer shall notify any severe incident having an impact on the security of the product with digital elements that it becomes aware of simultaneously to the CSIRT designated as coordinator, in accordance with paragraph 7 of this Article, and to ENISA. The manufacturer shall notify that incident via the single reporting platform established pursuant to Article 16. 4. For the purposes of the notification referred to in paragraph 3, the manufacturer shall submit: (a) an early warning notification of a severe incident having an impact on the security of the product with digital elements, without undue delay and in any event within 24 hours of the manufacturer becoming aware of it, including at least whether the incident is suspected of being caused by unlawful or malicious acts, which shall also indicate, where applicable, the Member States on the territory of which the manufacturer is aware that their product with digital elements has been made available; (b) unless the relevant information has already been provided, an incident notification, without undue delay and in any event within 72 hours of the manufacturer becoming aware of the incident, which shall provide general information, where available, about the nature of the incident, an initial assessment of the incident, as well as any corrective or mitigating measures taken, and corrective or mitigating measures that users can take, and which shall also indicate, where applicable, how sensitive the manufacturer considers the notified information to be; (c) unless the relevant information has already been provided, a final report, within one month after the submission of the incident notification under point (b), including at least the following: (i) a detailed description of the incident, including its severity and impact; (ii) the type of threat or root cause that is likely to have triggered the incident; (iii) applied and ongoing mitigation measures. 5. For the purposes of paragraph 3, an incident having an impact on the security of the product with digital elements shall be considered to be severe where: (a) it negatively affects or is capable of negatively affecting the ability of a product with digital elements to protect the availability, authenticity, integrity or confidentiality of sensitive or important data or functions; or (b) it has led or is capable of leading to the introduction or execution of malicious code in a product with digital elements or in the network and information systems of a user of the product with digital elements. 6. Where necessary, the CSIRT designated as coordinator initially receiving the notification may request manufacturers to provide an intermediate report on relevant status updates about the actively exploited vulnerability or severe incident having an impact on the security of the product with digital elements. 7. The notifications referred to in paragraphs 1 and 3 of this Article shall be submitted via the single reporting platform referred to in Article 16 using one of the electronic notification end-points referred to in Article 16(1). The notification shall be submitted using the electronic notification end-point of the CSIRT designated as coordinator of the Member State where the manufacturers have their main establishment in the Union and shall be simultaneously accessible to ENISA. For the purposes of this Regulation, a manufacturer shall be considered to have its main establishment in the Union in the Member State where the decisions related to the cybersecurity of its products with digital elements are predominantly taken. If such a Member State cannot be determined, the main establishment shall be considered to be in the Member State where the manufacturer concerned has the establishment with the highest number of employees in the Union. Where a manufacturer has no main establishment in the Union, it shall submit the notifications referred to in paragraphs 1 and 3 using the electronic notification end-point of the CSIRT designated as coordinator in the Member State determined pursuant to the following order and based on the information available to the manufacturer: (a) the Member State in which the authorised representative acting on behalf of the manufacturer for the highest number of products with digital elements of that manufacturer is established; (b) the Member State in which the importer placing on the market the highest number of products with digital elements of that manufacturer is established; (c) the Member State in which the distributor making available on the market the highest number of products with digital elements of that manufacturer is established; (d) the Member State in which the highest number of users of products with digital elements of that manufacturer are located. In relation to the third subparagraph, point (d), a manufacturer may submit notifications related to any subsequent actively exploited vulnerability or severe incident having an impact on the security of the product with digital elements to the same CSIRT designated as coordinator to which it first reported. 8. After becoming aware of an actively exploited vulnerability or a severe incident having an impact on the security of the product with digital elements, the manufacturer shall inform the impacted users of the product with digital elements, and where appropriate all users, of that vulnerability or incident and, where necessary, of any risk mitigation and corrective measures that the users can deploy to mitigate the impact of that vulnerability or incident, where appropriate in a structured, machine-readable format that is easily automatically processable. Where the manufacturer fails to inform the users of the product with digital elements in a timely manner, the notified CSIRTs designated as coordinators may provide such information to the users when considered to be proportionate and necessary for preventing or mitigating the impact of that vulnerability or incident. 9. By 11 December 2025, the Commission shall adopt delegated acts in accordance with Article 61 of this Regulation to supplement this Regulation by specifying the terms and conditions for applying the cybersecurity-related grounds in relation to delaying the dissemination of notifications as referred to in Article 16(2) of this Regulation. The Commission shall cooperate with the CSIRTs network established pursuant to Article 15 of Directive (EU) 2022/2555 and ENISA in preparing the draft delegated acts. 10. The Commission may, by means of implementing acts, specify further the format and procedures of the notifications referred to in this Article as well as in Articles 15 and 16. Those implementing acts shall be adopted in accordance with the examination procedure referred to in Article 62(2). The Commission shall cooperate with the CSIRTs network and ENISA in preparing those draft implementing acts."
"15","Voluntary reporting","II","OBLIGATIONS OF ECONOMIC OPERATORS AND PROVISIONS IN RELATION TO FREE AND OPEN-SOURCE SOFTWARE","1. Manufacturers as well as other natural or legal persons may notify any vulnerability contained in a product with digital elements as well as cyber threats that could affect the risk profile of a product with digital elements on a voluntary basis to a CSIRT designated as coordinator or ENISA. 2. Manufacturers as well as other natural or legal persons may notify any incident having an impact on the security of the product with digital elements as well as near misses that could have resulted in such an incident on a voluntary basis to a CSIRT designated as coordinator or ENISA. 3. The CSIRT designated as coordinator or ENISA shall process the notifications referred to in paragraphs 1 and 2 of this Article in accordance with the procedure laid down in Article 16. The CSIRT designated as coordinator may prioritise the processing of mandatory notifications over voluntary notifications. 4. Where a natural or legal person other than the manufacturer notifies an actively exploited vulnerability or a severe incident having an impact on the security of a product with digital elements in accordance with paragraph 1 or 2, the CSIRT designated as coordinator shall without undue delay inform the manufacturer. 5. The CSIRTs designated as coordinators as well as ENISA shall ensure the confidentiality and appropriate protection of the information provided by a notifying natural or legal person. Without prejudice to the prevention, investigation, detection and prosecution of criminal offences, voluntary reporting shall not result in the imposition of any additional obligations upon a notifying natural or legal person to which it would not have been subject had it not submitted the notification."
"16","Establishment of a single reporting platform","II","OBLIGATIONS OF ECONOMIC OPERATORS AND PROVISIONS IN RELATION TO FREE AND OPEN-SOURCE SOFTWARE","1. For the purposes of the notifications referred to in Article 14(1) and (3) and Article 15(1) and (2) and in order to simplify the reporting obligations of manufacturers, a single reporting platform shall be established by ENISA. The day-to-day operations of that single reporting platform shall be managed and maintained by ENISA. The architecture of the single reporting platform shall allow Member States and ENISA to put in place their own electronic notification end-points. 2. After receiving a notification, the CSIRT designated as coordinator initially receiving the notification shall, without delay, disseminate the notification via the single reporting platform to the CSIRTs designated as coordinators on the territory of which the manufacturer has indicated that the product with digital elements has been made available. In exceptional circumstances and, in particular, upon request by the manufacturer and in light of the level of sensitivity of the notified information as indicated by the manufacturer under Article 14(2), point (a), of this Regulation, the dissemination of the notification may be delayed based on justified cybersecurity-related grounds for a period of time that is strictly necessary, including where a vulnerability is subject to a coordinated vulnerability disclosure procedure as referred to in Article 12(1) of Directive (EU) 2022/2555. Where a CSIRT decides to withhold a notification, it shall immediately inform ENISA about the decision and provide both a justification for withholding the notification as well as an indication of when it will disseminate the notification in accordance with the dissemination procedure laid down in this paragraph. ENISA may support the CSIRT on the application of cybersecurity-related grounds in relation to delaying the dissemination of the notification. In particularly exceptional circumstances, where the manufacturer indicates in the notification referred to in Article 14(2), point (b): (a) that the notified vulnerability has been actively exploited by a malicious actor and, according to the information available, it has been exploited in no other Member State than the one of the CSIRT designated as coordinator to which the manufacturer has notified the vulnerability; (b) that any immediate further dissemination of the notified vulnerability would likely result in the supply of information the disclosure of which would be contrary to the essential interests of that Member State; or (c) that the notified vulnerability poses an imminent high cybersecurity risk stemming from the further dissemination; only the information that a notification was made by the manufacturer, the general information about the product, the information on the general nature of the exploit and the information that security related grounds were raised are to be made available simultaneously to ENISA until the full notification is disseminated to the CSIRTs concerned and ENISA. Where, based on that information, ENISA considers that there is a systemic risk affecting security in the internal market, it shall recommend to the recipient CSIRT that it disseminate the full notification to the other CSIRTs designated as coordinators and to ENISA itself. 3. After receiving a notification of an actively exploited vulnerability in a product with digital elements or of a severe incident having an impact on the security of a product with digital elements, the CSIRTs designated as coordinators shall provide the market surveillance authorities of their respective Member States with the notified information necessary for the market surveillance authorities to fulfil their obligations under this Regulation. 4. ENISA shall take appropriate and proportionate technical, operational and organisational measures to manage the risks posed to the security of the single reporting platform and the information submitted or disseminated via the single reporting platform. It shall notify without undue delay any security incident affecting the single reporting platform to the CSIRTs network as well as to the Commission. 5. ENISA, in cooperation with the CSIRTs network, shall provide and implement specifications on the technical, operational and organisational measures regarding the establishment, maintenance and secure operation of the single reporting platform referred to in paragraph 1, including at least the security arrangements related to the establishment, operation and maintenance of the single reporting platform, as well as the electronic notification end-points set up by the CSIRTs designated as coordinators at national level and ENISA at Union level, including procedural aspects to ensure that, where a notified vulnerability has no corrective or mitigating measures available, information about that vulnerability is shared in line with strict security protocols and on a need-to-know basis. 6. Where a CSIRT designated as coordinator has been made aware of an actively exploited vulnerability as part of a coordinated vulnerability disclosure procedure as referred to in Article 12(1) of Directive (EU) 2022/2555, the CSIRT designated as coordinator initially receiving the notification may delay the dissemination of the relevant notification via the single reporting platform based on justified cybersecurity-related grounds for a period that is no longer than is strictly necessary and until consent for disclosure by the involved coordinated vulnerability disclosure parties is given. That requirement shall not prevent manufacturers from notifying such a vulnerability on a voluntary basis in accordance with the procedure laid down in this Article."
"17","Other provisions related to reporting","II","OBLIGATIONS OF ECONOMIC OPERATORS AND PROVISIONS IN RELATION TO FREE AND OPEN-SOURCE SOFTWARE","1. ENISA may submit to the European cyber crisis liaison organisation network (EU-CyCLONe) established under Article 16 of Directive (EU) 2022/2555 information notified pursuant to Article 14(1) and (3) and Article 15(1) and (2) of this Regulation if such information is relevant for the coordinated management of large-scale cybersecurity incidents and crises at an operational level. For the purpose of determining such relevance, ENISA may consider technical analyses performed by the CSIRTs network, where available. 2. Where public awareness is necessary to prevent or mitigate a severe incident having an impact on the security of the product with digital elements or to handle an ongoing incident, or where disclosure of the incident is otherwise in the public interest, the CSIRT designated as coordinator of the relevant Member State may, after consulting the manufacturer concerned and, where appropriate, in cooperation with ENISA, inform the public about the incident or require the manufacturer to do so. 3. ENISA, on the basis of the notifications received pursuant to Article 14(1) and (3) and Article 15(1) and (2) of this Regulation, shall prepare, every 24 months, a technical report on emerging trends regarding cybersecurity risks in products with digital elements and submit it to the Cooperation Group established pursuant to Article 14 of Directive (EU) 2022/2555. The first such report shall be submitted within 24 months of the date of application of the obligations laid down in Article 14(1) and (3) of this Regulation. ENISA shall include relevant information from its technical reports in its report on the state of cybersecurity in the Union pursuant to Article 18 of Directive (EU) 2022/2555. 4. The mere act of notification in accordance with Article 14(1) and (3) or Article 15(1) and (2) shall not subject the notifying natural or legal person to increased liability. 5. After a security update or another form of corrective or mitigating measure is available, ENISA shall, in agreement with the manufacturer of the product with digital elements concerned, add the publicly known vulnerability notified pursuant to Article 14(1) or Article 15(1) of this Regulation to the European vulnerability database established pursuant to Article 12(2) of Directive (EU) 2022/2555. 6. The CSIRTs designated as coordinators shall provide helpdesk support in relation to the reporting obligations pursuant to Article 14 to manufacturers and in particular manufacturers that qualify as microenterprises or as small or medium-sized enterprises."
"18","Authorised representatives","II","OBLIGATIONS OF ECONOMIC OPERATORS AND PROVISIONS IN RELATION TO FREE AND OPEN-SOURCE SOFTWARE","1. A manufacturer may, by a written mandate, appoint an authorised representative. 2. The obligations laid down in Article 13(1) to (11), Article 13(12), first subparagraph, and Article 13(14) shall not form part of the authorised representative’s mandate. 3. An authorised representative shall perform the tasks specified in the mandate received from the manufacturer. The authorised representative shall provide a copy of the mandate to the market surveillance authorities upon request. The mandate shall allow the authorised representative to do at least the following: (a) keep the EU declaration of conformity referred to in Article 28 and the technical documentation referred to in Article 31 at the disposal of the market surveillance authorities for at least 10 years after the product with digital elements has been placed on the market or for the support period, whichever is longer; (b) further to a reasoned request from a market surveillance authority, provide that authority with all the information and documentation necessary to demonstrate the conformity of the product with digital elements; (c) cooperate with the market surveillance authorities, at their request, on any action taken to eliminate the risks posed by a product with digital elements covered by the authorised representative’s mandate."
