"article","article_name","chapter","chapter_name","content"
"19","Obligations of importers","II","OBLIGATIONS OF ECONOMIC OPERATORS AND PROVISIONS IN RELATION TO FREE AND OPEN-SOURCE SOFTWARE","1. Importers shall place on the market only products with digital elements that comply with the essential cybersecurity requirements set out in Part I of Annex I and where the processes put in place by the manufacturer comply with the essential cybersecurity requirements set out in Part II of Annex I. 2. Before placing a product with digital elements on the market, importers shall ensure that: (a) the appropriate conformity assessment procedures as referred to in Article 32 have been carried out by the manufacturer; (b) the manufacturer has drawn up the technical documentation; (c) the product with digital elements bears the CE marking referred to in Article 30 and is accompanied by the EU declaration of conformity referred to in Article 13(20) and the information and instructions to the user as set out in Annex II in a language which can be easily understood by users and market surveillance authorities; (d) the manufacturer has complied with the requirements set out in Article 13(15), (16) and (19). For the purposes of this paragraph, importers shall be able to provide the necessary documents proving the fulfilment of the requirements set out in this Article. 3. Where an importer considers or has reason to believe that a product with digital elements or the processes put in place by the manufacturer are not in conformity with this Regulation, the importer shall not place the product on the market until that product or the processes put in place by the manufacturer have been brought into conformity with this Regulation. Furthermore, where the product with digital elements presents a significant cybersecurity risk, the importer shall inform the manufacturer and the market surveillance authorities to that effect. Where an importer has reason to believe that a product with digital elements may present a significant cybersecurity risk in light of non-technical risk factors, the importer shall inform the market surveillance authorities to that effect. Upon receipt of such information, the market surveillance authorities shall follow the procedures referred to in Article 54(2). 4. Importers shall indicate their name, registered trade name or registered trademark, the postal address, email address or other digital contact as well as, where applicable, the website at which they can be contacted on the product with digital elements or on its packaging or in a document accompanying the product with digital elements. The contact details shall be in a language easily understood by users and market surveillance authorities. 5. Importers who know or have reason to believe that a product with digital elements which they have placed on the market is not in conformity with this Regulation shall immediately take the corrective measures necessary to ensure that the product with digital elements is brought into conformity with this Regulation, or to withdraw or recall the product, if appropriate. Upon becoming aware of a vulnerability in the product with digital elements, importers shall inform the manufacturer without undue delay about that vulnerability. Furthermore, where the product with digital elements presents a significant cybersecurity risk, importers shall immediately inform the market surveillance authorities of the Member States in which they have made the product with digital elements available on the market to that effect, giving details, in particular, of non-compliance and of any corrective measures taken. 6. Importers shall, for at least 10 years after the product with digital elements has been placed on the market or for the support period, whichever is longer, keep a copy of the EU declaration of conformity at the disposal of the market surveillance authorities and ensure that the technical documentation can be made available to those authorities, upon request. 7. Importers shall, further to a reasoned request from a market surveillance authority, provide it with all the information and documentation, in paper or electronic form, necessary to demonstrate the conformity of the product with digital elements with the essential cybersecurity requirements set out in Part I of Annex I as well as of the processes put in place by the manufacturer with the essential cybersecurity requirements set out in Part II of Annex I in a language that can be easily understood by that authority. They shall cooperate with that authority, at its request, on any measures taken to eliminate the cybersecurity risks posed by a product with digital elements, which they have placed on the market. 8. Where the importer of a product with digital elements becomes aware that the manufacturer of that product has ceased its operations and, as result, is not able to comply with the obligations laid down in this Regulation, the importer shall inform the relevant market surveillance authorities about this situation, as well as, by any means available and to the extent possible, the users of the products with digital elements placed on the market."
"20","Obligations of distributors","II","OBLIGATIONS OF ECONOMIC OPERATORS AND PROVISIONS IN RELATION TO FREE AND OPEN-SOURCE SOFTWARE","1. When making a product with digital elements available on the market, distributors shall act with due care in relation to the requirements set out in this Regulation. 2. Before making a product with digital elements available on the market, distributors shall verify that: (a) the product with digital elements bears the CE marking; (b) the manufacturer and the importer have complied with the obligations set out in Article 13(15), (16), (18), (19) and (20) and Article 19(4), and have provided all necessary documents to the distributor. 3. Where a distributor considers or has reason to believe, on the basis of information in its possession, that a product with digital elements or the processes put in place by the manufacturer are not in conformity with the essential cybersecurity requirements set out in Annex I, the distributor shall not make the product with digital elements available on the market until that product or the processes put in place by the manufacturer have been brought into conformity with this Regulation. Furthermore, where the product with digital elements poses a significant cybersecurity risk, the distributor shall inform, without undue delay, the manufacturer and the market surveillance authorities to that effect. 4. Distributors who know or have reason to believe, on the basis of information in their possession, that a product with digital elements, which they have made available on the market, or the processes put in place by its manufacturer are not in conformity with this Regulation shall make sure that the corrective measures necessary to bring that product with digital elements or the processes put in place by its manufacturer into conformity, or to withdraw or recall the product, if appropriate, are taken. Upon becoming aware of a vulnerability in the product with digital elements, distributors shall inform the manufacturer without undue delay about that vulnerability. Furthermore, where the product with digital elements presents a significant cybersecurity risk, distributors shall immediately inform the market surveillance authorities of the Member States in which they have made the product with digital elements available on the market to that effect, giving details, in particular, of the non-compliance and of any corrective measures taken. 5. Distributors shall, further to a reasoned request from a market surveillance authority, provide all the information and documentation, in paper or electronic form, necessary to demonstrate the conformity of the product with digital elements and the processes put in place by its manufacturer with this Regulation in a language that can be easily understood by that authority. They shall cooperate with that authority, at its request, on any measures taken to eliminate the cybersecurity risks posed by a product with digital elements which they have made available on the market. 6. Where the distributor of a product with digital elements becomes aware, on the basis of information in its possession, that the manufacturer of that product has ceased its operations and, as result, is not able to comply with the obligations laid down in this Regulation, the distributor shall inform, without undue delay, the relevant market surveillance authorities about this situation, as well as, by any means available and to the extent possible, the users of the products with digital elements placed on the market."
"21","Cases in which obligations of manufacturers apply to importers and distributors","II","OBLIGATIONS OF ECONOMIC OPERATORS AND PROVISIONS IN RELATION TO FREE AND OPEN-SOURCE SOFTWARE","An importer or distributor shall be considered to be a manufacturer for the purposes of this Regulation and shall be subject to Articles 13 and 14, where that importer or distributor places a product with digital elements on the market under its name or trademark or carries out a substantial modification of a product with digital elements already placed on the market."
"22","Other cases in which obligations of manufacturers apply","II","OBLIGATIONS OF ECONOMIC OPERATORS AND PROVISIONS IN RELATION TO FREE AND OPEN-SOURCE SOFTWARE","1. A natural or legal person, other than the manufacturer, the importer or the distributor, that carries out a substantial modification of a product with digital elements and makes that product available on the market, shall be considered to be a manufacturer for the purposes of this Regulation. 2. The person referred to in paragraph 1 of this Article shall be subject to the obligations set out in Articles 13 and 14 for the part of the product with digital elements that is affected by the substantial modification or, if the substantial modification has an impact on the cybersecurity of the product with digital elements as a whole, for the entire product."
"23","Identification of economic operators","II","OBLIGATIONS OF ECONOMIC OPERATORS AND PROVISIONS IN RELATION TO FREE AND OPEN-SOURCE SOFTWARE","1. Economic operators shall, on request, provide the market surveillance authorities with the following information: (a) the name and address of any economic operator who has supplied them with a product with digital elements; (b) where available, the name and address of any economic operator to whom they have supplied a product with digital elements. 2. Economic operators shall be able to present the information referred to in paragraph 1 for 10 years after they have been supplied with the product with digital elements and for 10 years after they have supplied the product with digital elements."
"24","Obligations of open-source software stewards","II","OBLIGATIONS OF ECONOMIC OPERATORS AND PROVISIONS IN RELATION TO FREE AND OPEN-SOURCE SOFTWARE","1. Open-source software stewards shall put in place and document in a verifiable manner a cybersecurity policy to foster the development of a secure product with digital elements as well as an effective handling of vulnerabilities by the developers of that product. That policy shall also foster the voluntary reporting of vulnerabilities as laid down in Article 15 by the developers of that product and take into account the specific nature of the open-source software steward and the legal and organisational arrangements to which it is subject. That policy shall, in particular, include aspects related to documenting, addressing and remediating vulnerabilities and promote the sharing of information concerning discovered vulnerabilities within the open-source community. 2. Open-source software stewards shall cooperate with the market surveillance authorities, at their request, with a view to mitigating the cybersecurity risks posed by a product with digital elements qualifying as free and open-source software. Further to a reasoned request from a market surveillance authority, open-source software stewards shall provide that authority, in a language which can be easily understood by that authority, with the documentation referred to in paragraph 1, in paper or electronic form. 3. The obligations laid down in Article 14(1) shall apply to open-source software stewards to the extent that they are involved in the development of the products with digital elements. The obligations laid down in Article 14(3) and (8) shall apply to open-source software stewards to the extent that severe incidents having an impact on the security of products with digital elements affect network and information systems provided by the open-source software stewards for the development of such products."
"25","Security attestation of free and open-source software","II","OBLIGATIONS OF ECONOMIC OPERATORS AND PROVISIONS IN RELATION TO FREE AND OPEN-SOURCE SOFTWARE","In order to facilitate the due diligence obligation set out in Article 13(5), in particular as regards manufacturers that integrate free and open-source software components in their products with digital elements, the Commission is empowered to adopt delegated acts in accordance with Article 61 to supplement this Regulation by establishing voluntary security attestation programmes allowing the developers or users of products with digital elements qualifying as free and open-source software as well as other third parties to assess the conformity of such products with all or certain essential cybersecurity requirements or other obligations laid down in this Regulation."
"26","Guidance","II","OBLIGATIONS OF ECONOMIC OPERATORS AND PROVISIONS IN RELATION TO FREE AND OPEN-SOURCE SOFTWARE","1. In order to facilitate implementation and ensure the consistency of such implementation, the Commission shall publish guidance to assist economic operators in applying this Regulation, with a particular focus on facilitating compliance by microenterprises and small and medium-sized enterprises. 2. Where it intends to provide guidance as referred to in paragraph 1, the Commission shall address at least the following aspects: (a) the scope of this Regulation, with a particular focus on remote data processing solutions and free and open-source software; (b) the application of support periods in relation to particular categories of products with digital elements; (c) guidance targeted at manufacturers subject to this Regulation that are also subject to Union harmonisation legislation other than this Regulation or to other related Union legal acts; (d) the concept of substantial modification. The Commission shall also maintain an easy-to-access list of the delegated and implementing acts adopted pursuant to this Regulation. 3. When preparing the guidance pursuant to this Article, the Commission shall consult relevant stakeholders."
"27","Presumption of conformity","III","CONFORMITY OF THE PRODUCT WITH DIGITAL ELEMENTS","1. Products with digital elements and processes put in place by the manufacturer which are in conformity with harmonised standards or parts thereof, the references of which have been published in the Official Journal of the European Union , shall be presumed to be in conformity with the essential cybersecurity requirements set out in Annex I covered by those standards or parts thereof. The Commission shall, in accordance with Article 10(1) of Regulation (EU) No 1025/2012, request one or more European standardisation organisations to draft harmonised standards for the essential cybersecurity requirements set out in Annex I to this Regulation. When preparing standardisation requests for this Regulation, the Commission shall strive to take into account existing European and international standards for cybersecurity that are in place or under development in order to simplify the development of harmonised standards, in accordance with Regulation (EU) No 1025/2012. 2. The Commission may adopt implementing acts establishing common specifications covering technical requirements that provide a means to comply with the essential cybersecurity requirements set out in Annex I for products with digital elements that fall within the scope of this Regulation. Those implementing acts shall be adopted only where the following conditions are fulfilled: (a) the Commission has requested, pursuant to Article 10(1) of Regulation (EU) No 1025/2012, one or more European standardisation organisations to draft a harmonised standard for the essential cybersecurity requirements set out in Annex I and: (i) the request has not been accepted; (ii) the harmonised standards addressing that request are not delivered within the deadline set in accordance with Article 10(1) of Regulation (EU) No 1025/2012; or (iii) the harmonised standards do not comply with the request; and (b) no reference to harmonised standards covering the relevant essential cybersecurity requirements set out in Annex I to this Regulation has been published in the Official Journal of the European Union in accordance with Regulation (EU) No 1025/2012 and no such reference is expected to be published within a reasonable period. Those implementing acts shall be adopted in accordance with the examination procedure referred to in Article 62(2). 3. Before preparing the draft implementing act referred to in paragraph 2 of this Article, the Commission shall inform the committee referred to in Article 22 of Regulation (EU) No 1025/2012 that it considers that the conditions in paragraph 2 of this Article have been fulfilled. 4. When preparing the draft implementing act referred to in paragraph 2, the Commission shall take into account the views of relevant bodies and shall duly consult all relevant stakeholders. 5. Products with digital elements and processes put in place by the manufacturer which are in conformity with the common specifications established by implementing acts referred to in paragraph 2 of this Article, or parts thereof, shall be presumed to be in conformity with the essential cybersecurity requirements set out in Annex I covered by those common specifications or parts thereof. 6. Where a harmonised standard is adopted by a European standardisation organisation and proposed to the Commission for the purpose of publishing its reference in the Official Journal of the European Union , the Commission shall assess the harmonised standard in accordance with Regulation (EU) No 1025/2012. When a reference of a harmonised standard is published in the Official Journal of the European Union , the Commission shall repeal the implementing acts referred to in paragraph 2 of this Article, or parts thereof which cover the same essential cybersecurity requirements as those covered by that harmonised standard. 7. Where a Member State considers that a common specification does not entirely satisfy the essential cybersecurity requirements set out in Annex I, it shall inform the Commission thereof by submitting a detailed explanation. The Commission shall assess that detailed explanation and may, if appropriate, amend the implementing act establishing the common specification in question. 8. Products with digital elements and processes put in place by the manufacturer for which an EU statement of conformity or certificate has been issued under a European cybersecurity certification scheme adopted pursuant to Regulation (EU) 2019/881 shall be presumed to be in conformity with the essential cybersecurity requirements set out in Annex I in so far as the EU statement of conformity or European cybersecurity certificate, or parts thereof, cover those requirements. 9. The Commission is empowered to adopt delegated acts in accordance with Article 61 of this Regulation to supplement this Regulation by specifying the European cybersecurity certification schemes adopted pursuant to Regulation (EU) 2019/881 that can be used to demonstrate conformity of products with digital elements with the essential cybersecurity requirements or parts thereof as set out in Annex I to this Regulation. Furthermore, the issuance of a European cybersecurity certificate issued under such schemes, at least at assurance level ‘substantial’, eliminates the obligation of a manufacturer to carry out a third-party conformity assessment for the corresponding requirements, as set out in Article 32(2), points (a) and (b), and Article 32(3), points (a) and (b), of this Regulation."
"28","EU declaration of conformity","III","CONFORMITY OF THE PRODUCT WITH DIGITAL ELEMENTS","1. The EU declaration of conformity shall be drawn up by manufacturers in accordance with Article 13(12) and state that the fulfilment of the applicable essential cybersecurity requirements set out in Annex I has been demonstrated. 2. The EU declaration of conformity shall have the model structure set out in Annex V and shall contain the elements specified in the relevant conformity assessment procedures set out in Annex VIII. Such a declaration shall be updated as appropriate. It shall be made available in the languages required by the Member State in which the product with digital elements is placed on the market or made available on the market. The simplified EU declaration of conformity referred to in Article 13(20) shall have the model structure set out in Annex VI. It shall be made available in the languages required by the Member State in which the product with digital elements is placed on the market or made available on the market. 3. Where a product with digital elements is subject to more than one Union legal act requiring an EU declaration of conformity, a single EU declaration of conformity shall be drawn up in respect of all such Union legal acts. That declaration shall contain the identification of the Union legal acts concerned, including their publication references. 4. By drawing up the EU declaration of conformity, the manufacturer shall assume responsibility for the compliance of the product with digital elements. 5. The Commission is empowered to adopt delegated acts in accordance with Article 61 to supplement this Regulation by adding elements to the minimum content of the EU declaration of conformity set out in Annex V to take account of technological developments."
"29","General principles of the CE marking","III","CONFORMITY OF THE PRODUCT WITH DIGITAL ELEMENTS","The CE marking shall be subject to the general principles set out in Article 30 of Regulation (EC) No 765/2008."
"30","Rules and conditions for affixing the CE marking","III","CONFORMITY OF THE PRODUCT WITH DIGITAL ELEMENTS","1. The CE marking shall be affixed visibly, legibly and indelibly to the product with digital elements. Where that is not possible or not warranted on account of the nature of the product with digital elements, it shall be affixed to the packaging and to the EU declaration of conformity referred to in Article 28 accompanying the product with digital elements. For products with digital elements which are in the form of software, the CE marking shall be affixed either to the EU declaration of conformity referred to in Article 28 or on the website accompanying the software product. In the latter case, the relevant section of the website shall be easily and directly accessible to consumers. 2. On account of the nature of the product with digital elements, the height of the CE marking affixed to the product with digital elements may be lower than 5 mm, provided that it remains visible and legible. 3. The CE marking shall be affixed before the product with digital elements is placed on the market. It may be followed by a pictogram or any other mark indicating a special cybersecurity risk or use set out in the implementing acts referred to in paragraph 6. 4. The CE marking shall be followed by the identification number of the notified body, where that body is involved in the conformity assessment procedure based on full quality assurance (based on module H) referred to in Article 32. The identification number of the notified body shall be affixed by the body itself or, under its instructions, by the manufacturer or the manufacturer’s authorised representative. 5. Member States shall build upon existing mechanisms to ensure correct application of the regime governing the CE marking and shall take appropriate action in the event of improper use of that marking. Where the product with digital elements is subject to Union harmonisation legislation, other than this Regulation, which also provides for the affixing of the CE marking, the CE marking shall indicate that the product also fulfils the requirements set out in such other Union harmonisation legislation. 6. The Commission may, by means of implementing acts, lay down technical specifications for labels, pictograms or any other marks related to the security of the products with digital elements, their support periods and mechanisms to promote their use and to increase public awareness about the security of products with digital elements. When preparing the draft implementing acts, the Commission shall consult relevant stakeholders, and, if it has already been established pursuant to Article 52(15), ADCO. Those implementing acts shall be adopted in accordance with the examination procedure referred to in Article 62(2)."
