"article","article_name","chapter","chapter_name","content"
"31","Technical documentation","III","CONFORMITY OF THE PRODUCT WITH DIGITAL ELEMENTS","1. The technical documentation shall contain all relevant data or details of the means used by the manufacturer to ensure that the product with digital elements and the processes put in place by the manufacturer comply with the essential cybersecurity requirements set out in Annex I. It shall at least contain the elements set out in Annex VII. 2. The technical documentation shall be drawn up before the product with digital elements is placed on the market and shall be continuously updated, where appropriate, at least during the support period. 3. For products with digital elements as referred to in Article 12, which are also subject to other Union legal acts which provide for technical documentation, a single set of technical documentation shall be drawn up containing the information referred to in Annex VII and the information required by those Union legal acts. 4. The technical documentation and correspondence relating to any conformity assessment procedure shall be drawn up in an official language of the Member State in which the notified body is established or in a language acceptable to that body. 5. The Commission is empowered to adopt delegated acts in accordance with Article 61 to supplement this Regulation by adding elements to be included in the technical documentation set out in Annex VII to take account of technological developments, as well as developments encountered in the implementation process of this Regulation. To that end, the Commission shall strive to ensure that the administrative burden on microenterprises and small and medium-sized enterprises is proportionate."
"32","Conformity assessment procedures for products with digital elements","III","CONFORMITY OF THE PRODUCT WITH DIGITAL ELEMENTS","1. The manufacturer shall perform a conformity assessment of the product with digital elements and the processes put in place by the manufacturer to determine whether the essential cybersecurity requirements set out in Annex I are met. The manufacturer shall demonstrate conformity with the essential cybersecurity requirements by using any of the following procedures: (a) the internal control procedure (based on module A) set out in Annex VIII; (b) the EU-type examination procedure (based on module B) set out in Annex VIII followed by conformity to EU-type based on internal production control (based on module C) set out in Annex VIII; (c) a conformity assessment based on full quality assurance (based on module H) set out in Annex VIII; or (d) where available and applicable, a European cybersecurity certification scheme pursuant to Article 27(9). 2. Where, in assessing the compliance of an important product with digital elements that falls under class I as set out in Annex III and the processes put in place by its manufacturer with the essential cybersecurity requirements set out in Annex I, the manufacturer has not applied or has applied only in part harmonised standards, common specifications or European cybersecurity certification schemes at assurance level at least ‘substantial’ as referred to in Article 27, or where such harmonised standards, common specifications or European cybersecurity certification schemes do not exist, the product with digital elements concerned and the processes put in place by the manufacturer shall be submitted with regard to those essential cybersecurity requirements to either of the following procedures: (a) the EU-type examination procedure (based on module B) set out in Annex VIII followed by conformity to EU-type based on internal production control (based on module C) set out in Annex VIII; or (b) a conformity assessment based on full quality assurance (based on module H) set out in Annex VIII. 3. Where the product is an important product with digital elements that falls under class II as set out in Annex III, the manufacturer shall demonstrate conformity with the essential cybersecurity requirements set out in Annex I by using any of the following procedures: (a) EU-type examination procedure (based on module B) set out in Annex VIII followed by conformity to EU-type based on internal production control (based on module C) set out in Annex VIII; (b) a conformity assessment based on full quality assurance (based on module H) set out in Annex VIII; or (c) where available and applicable, a European cybersecurity certification scheme pursuant to Article 27(9) of this Regulation at assurance level at least ‘substantial’ pursuant to Regulation (EU) 2019/881. 4. Critical products with digital elements listed in Annex IV shall demonstrate conformity with the essential cybersecurity requirements set out in Annex I by using one of the following procedures: (a) a European cybersecurity certification scheme in accordance with Article 8(1); or (b) where the conditions in Article 8(1) are not met, any of the procedures referred to in paragraph 3 of this Article. 5. Manufacturers of products with digital elements qualifying as free and open-source software, which fall under the categories set out in Annex III, shall be able to demonstrate conformity with the essential cybersecurity requirements set out in Annex I by using one of the procedures referred to in paragraph 1 of this Article, provided that the technical documentation referred to in Article 31 is made available to the public at the time of the placing on the market of those products. 6. The specific interests and needs of microenterprises and small and medium-sized enterprises, including start-ups, shall be taken into account when setting the fees for conformity assessment procedures and those fees shall be reduced proportionately to their specific interests and needs."
"33","Support measures for microenterprises and small and medium-sized enterprises, including start-ups","III","CONFORMITY OF THE PRODUCT WITH DIGITAL ELEMENTS","1. Member States shall, where appropriate, undertake the following actions, tailored to the needs of microenterprises and small enterprises: (a) organise specific awareness-raising and training activities about the application of this Regulation; (b) establish a dedicated channel for communication with microenterprises and small enterprises and, as appropriate, local public authorities to provide advice and respond to queries about the implementation of this Regulation; (c) support testing and conformity assessment activities, including where relevant with the support of the European Cybersecurity Competence Centre. 2. Member States may, where appropriate, establish cyber resilience regulatory sandboxes. Such regulatory sandboxes shall provide for controlled testing environments for innovative products with digital elements to facilitate their development, design, validation and testing for the purpose of complying with this Regulation for a limited period of time before the placing on the market. The Commission and, where appropriate, ENISA, may provide technical support, advice and tools for the establishment and operation of regulatory sandboxes. The regulatory sandboxes shall be set up under the direct supervision, guidance and support by the market surveillance authorities. Member States shall inform the Commission and the other market surveillance authorities of the establishment of a regulatory sandbox through ADCO. The regulatory sandboxes shall not affect the supervisory and corrective powers of the competent authorities. Member States shall ensure open, fair, and transparent access to regulatory sandboxes, and in particular facilitate access by microenterprises and small enterprises, including start-ups. 3. In accordance with Article 26, the Commission shall provide guidance for microenterprises and small and medium-sized enterprises in relation to the implementation of this Regulation. 4. The Commission shall advertise available financial support in the regulatory framework of existing Union programmes, in particular in order to ease the financial burden on microenterprises and small enterprises. 5. Microenterprises and small enterprises may provide all elements of the technical documentation specified in Annex VII by using a simplified format. For that purpose, the Commission shall, by means of implementing acts, specify the simplified technical documentation form targeted at the needs of microenterprises and small enterprises, including how the elements set out in Annex VII are to be provided. Where a microenterprise or small enterprise opts to provide the information set out in Annex VII in a simplified manner, it shall use the form referred to in this paragraph. Notified bodies shall accept that form for the purposes of conformity assessment. Those implementing acts shall be adopted in accordance with the examination procedure referred to in Article 62(2)."
"34","Mutual recognition agreements","III","CONFORMITY OF THE PRODUCT WITH DIGITAL ELEMENTS","Taking into account the level of technical development and the approach on conformity assessment of a third country, the Union may conclude Mutual Recognition Agreements with third countries, in accordance with Article 218 TFEU, in order to promote and facilitate international trade."
"35","Notification","IV","NOTIFICATION OF CONFORMITY ASSESSMENT BODIES","1. Member States shall notify the Commission and the other Member States of bodies authorised to carry out conformity assessments in accordance with this Regulation. 2. Member States shall strive to ensure, by 11 December 2026 that there is a sufficient number of notified bodies in the Union to carry out conformity assessments, in order to avoid bottlenecks and hindrances to market entry."
"36","Notifying authorities","IV","NOTIFICATION OF CONFORMITY ASSESSMENT BODIES","1. Each Member State shall designate a notifying authority that shall be responsible for setting up and carrying out the necessary procedures for the assessment, designation and notification of conformity assessment bodies and their monitoring, including compliance with Article 41. 2. Member States may decide that the assessment and monitoring referred to in paragraph 1 shall be carried out by a national accreditation body within the meaning of and in accordance with Regulation (EC) No 765/2008. 3. Where the notifying authority delegates or otherwise entrusts the assessment, notification or monitoring referred to in paragraph 1 of this Article to a body which is not a governmental entity, that body shall be a legal entity and shall comply mutatis mutandis with Article 37. In addition, it shall have arrangements in place to cover liabilities arising from its activities. 4. The notifying authority shall take full responsibility for the tasks performed by the body referred to in paragraph 3."
"37","Requirements relating to notifying authorities","IV","NOTIFICATION OF CONFORMITY ASSESSMENT BODIES","1. A notifying authority shall be established in such a way that no conflict of interest with conformity assessment bodies occurs. 2. A notifying authority shall be organised and shall function so as to safeguard the objectivity and impartiality of its activities. 3. A notifying authority shall be organised in such a way that each decision relating to notification of a conformity assessment body is taken by competent persons different from those who carried out the assessment. 4. A notifying authority shall not offer or provide any activities that conformity assessment bodies perform or consultancy services on commercial or competitive basis. 5. A notifying authority shall safeguard the confidentiality of the information it obtains. 6. A notifying authority shall have a sufficient number of competent personnel at its disposal for the proper performance of its tasks."
"38","Information obligation on notifying authorities","IV","NOTIFICATION OF CONFORMITY ASSESSMENT BODIES","1. Member States shall inform the Commission of their procedures for the assessment and notification of conformity assessment bodies and the monitoring of notified bodies, and of any changes thereto. 2. The Commission shall make the information referred to in paragraph 1 publicly available."
"39","Requirements relating to notified bodies","IV","NOTIFICATION OF CONFORMITY ASSESSMENT BODIES","1. For the purposes of notification, a conformity assessment body shall meet the requirements laid down in paragraphs 2 to 12. 2. A conformity assessment body shall be established under national law and have legal personality. 3. A conformity assessment body shall be a third-party body independent of the organisation or the product with digital elements it assesses. A body belonging to a business association or professional federation representing undertakings involved in the design, development, production, provision, assembly, use or maintenance of products with digital elements which it assesses, may, on condition that its independence and the absence of any conflict of interest are demonstrated, be considered to be such a third-party body. 4. A conformity assessment body, its top level management and the personnel responsible for carrying out the conformity assessment tasks shall not be the designer, developer, manufacturer, supplier, importer, distributor, installer, purchaser, owner, user or maintainer of the products with digital elements which they assess, nor the authorised representative of any of those parties. This shall not preclude the use of assessed products that are necessary for the operations of the conformity assessment body or the use of such products for personal purposes. A conformity assessment body, its top level management and the personnel responsible for carrying out the conformity assessment tasks shall not be directly involved in the design, development, production, import, distribution, the marketing, installation, use or maintenance of the products with digital elements which they assess, or represent the parties engaged in those activities. They shall not engage in any activity that may conflict with their independence of judgement or integrity in relation to conformity assessment activities for which they are notified. This shall in particular apply to consultancy services. Conformity assessment bodies shall ensure that the activities of their subsidiaries or subcontractors do not affect the confidentiality, objectivity or impartiality of their conformity assessment activities. 5. Conformity assessment bodies and their personnel shall carry out the conformity assessment activities with the highest degree of professional integrity and the requisite technical competence in the specific field and shall be free from all pressures and inducements, particularly financial, which might influence their judgement or the results of their conformity assessment activities, especially as regards persons or groups of persons with an interest in the results of those activities. 6. A conformity assessment body shall be capable of carrying out all the conformity assessment tasks referred to in Annex VIII and in relation to which it has been notified, regardless of whether those tasks are carried out by the conformity assessment body itself or on its behalf and under its responsibility. At all times and for each conformity assessment procedure and each kind or category of products with digital elements in relation to which it has been notified, a conformity assessment body shall have at its disposal the necessary: (a) personnel with technical knowledge and sufficient and appropriate experience to perform the conformity assessment tasks; (b) descriptions of procedures in accordance with which conformity assessment is to be carried out, ensuring the transparency of and ability to reproduce those procedures. It shall have appropriate policies and procedures in place that distinguish between tasks it carries out as a notified body and other activities; (c) procedures for the performance of activities which take due account of the size of an undertaking, the sector in which it operates, its structure, the degree of complexity of the product technology in question and the mass or serial nature of the production process. A conformity assessment body shall have the means necessary to perform the technical and administrative tasks connected with the conformity assessment activities in an appropriate manner and shall have access to all necessary equipment or facilities. 7. The personnel responsible for carrying out conformity assessment activities shall have the following: (a) sound technical and vocational training covering all the conformity assessment activities in relation to which the conformity assessment body has been notified; (b) satisfactory knowledge of the requirements of the assessments they carry out and adequate authority to carry out those assessments; (c) appropriate knowledge and understanding of the essential cybersecurity requirements set out in Annex I, of the applicable harmonised standards and common specifications, and of the relevant provisions of Union harmonisation legislation and implementing acts; (d) the ability to draw up certificates, records and reports demonstrating that assessments have been carried out. 8. The impartiality of the conformity assessment bodies, their top level management and of the assessment personnel shall be guaranteed. The remuneration of the top level management and assessment personnel of a conformity assessment body shall not depend on the number of assessments carried out or on the results of those assessments. 9. Conformity assessment bodies shall take out liability insurance unless liability is assumed by their Member State in accordance with national law, or the Member State itself is directly responsible for the conformity assessment. 10. The personnel of a conformity assessment body shall observe professional secrecy with regard to all information obtained in carrying out their tasks under Annex VIII or any provision of national law giving effect to it, except in relation to the market surveillance authorities of the Member State in which its activities are carried out. Proprietary rights shall be protected. The conformity assessment body shall have documented procedures ensuring compliance with this paragraph. 11. Conformity assessment bodies shall participate in, or ensure that their assessment personnel are informed of, the relevant standardisation activities and the activities of the notified body coordination group established under Article 51 and apply as general guidance the administrative decisions and documents produced as a result of the work of that group. 12. Conformity assessment bodies shall operate in accordance with a set of consistent, fair, proportionate and reasonable terms and conditions, while avoiding unnecessary burden for economic operators, in particular taking into account the interests of microenterprises and small and medium-sized enterprises in relation to fees."
"40","Presumption of conformity of notified bodies","IV","NOTIFICATION OF CONFORMITY ASSESSMENT BODIES","Where a conformity assessment body demonstrates its conformity with the criteria laid down in the relevant harmonised standards or parts thereof the references of which have been published in the Official Journal of the European Union it shall be presumed to comply with the requirements set out in Article 39 in so far as the applicable harmonised standards cover those requirements."
"41","Subsidiaries of and subcontracting by notified bodies","IV","NOTIFICATION OF CONFORMITY ASSESSMENT BODIES","1. Where a notified body subcontracts specific tasks connected with conformity assessment or has recourse to a subsidiary, it shall ensure that the subcontractor or the subsidiary meets the requirements set out in Article 39 and shall inform the notifying authority accordingly. 2. Notified bodies shall take full responsibility for the tasks performed by subcontractors or subsidiaries wherever they are established. 3. Activities may be subcontracted or carried out by a subsidiary only with the agreement of the manufacturer. 4. Notified bodies shall keep at the disposal of the notifying authority the relevant documents concerning the assessment of the qualifications of the subcontractor or the subsidiary and the work carried out by them under this Regulation."
"42","Application for notification","IV","NOTIFICATION OF CONFORMITY ASSESSMENT BODIES","1. A conformity assessment body shall submit an application for notification to the notifying authority of the Member State in which it is established. 2. That application shall be accompanied by a description of the conformity assessment activities, the conformity assessment procedure or procedures and the product or products with digital elements for which that body claims to be competent, as well as, where applicable, by an accreditation certificate issued by a national accreditation body attesting that the conformity assessment body fulfils the requirements laid down in Article 39. 3. Where the conformity assessment body concerned cannot provide an accreditation certificate, it shall provide the notifying authority with all the documentary evidence necessary for the verification, recognition and regular monitoring of its compliance with the requirements laid down in Article 39."
"43","Notification procedure","IV","NOTIFICATION OF CONFORMITY ASSESSMENT BODIES","1. Notifying authorities shall notify only conformity assessment bodies which have satisfied the requirements laid down in Article 39. 2. The notifying authority shall notify the Commission and the other Member States using the New Approach Notified and Designated Organisations information system developed and managed by the Commission. 3. The notification shall include full details of the conformity assessment activities, the conformity assessment module or modules and product or products with digital elements concerned and the relevant attestation of competence. 4. Where a notification is not based on an accreditation certificate as referred to in Article 42(2), the notifying authority shall provide the Commission and the other Member States with documentary evidence which attests to the conformity assessment body’s competence and the arrangements in place to ensure that that body will be monitored regularly and will continue to satisfy the requirements laid down in Article 39. 5. The body concerned may perform the activities of a notified body only where no objections are raised by the Commission or the other Member States within two weeks of a notification where an accreditation certificate is used or within two months of a notification where accreditation is not used. Only such a body shall be considered to be a notified body for the purposes of this Regulation. 6. The Commission and the other Member States shall be notified of any subsequent relevant changes to the notification."
"44","Identification numbers and lists of notified bodies","IV","NOTIFICATION OF CONFORMITY ASSESSMENT BODIES","1. The Commission shall assign an identification number to a notified body. It shall assign a single such number even where the body is notified under several Union legal acts. 2. The Commission shall make publicly available the list of the bodies notified under this Regulation, including the identification numbers that have been allocated to them and the activities for which they have been notified. The Commission shall ensure that that list is kept up to date."
"45","Changes to notifications","IV","NOTIFICATION OF CONFORMITY ASSESSMENT BODIES","1. Where a notifying authority has ascertained or has been informed that a notified body no longer meets the requirements laid down in Article 39, or that it is failing to fulfil its obligations, the notifying authority shall restrict, suspend or withdraw notification as appropriate, depending on the seriousness of the failure to meet those requirements or fulfil those obligations. It shall immediately inform the Commission and the other Member States accordingly. 2. In the event of restriction, suspension or withdrawal of notification, or where the notified body has ceased its activity, the notifying Member State shall take appropriate steps to ensure that the files of that body are either processed by another notified body or kept available for the responsible notifying and market surveillance authorities at their request."
"46","Challenge of the competence of notified bodies","IV","NOTIFICATION OF CONFORMITY ASSESSMENT BODIES","1. The Commission shall investigate all cases where it doubts, or where doubt is brought to its attention regarding, the competence of a notified body to meet, or the continued fulfilment by a notified body of, the requirements and responsibilities to which it is subject. 2. The notifying Member State shall provide the Commission, on request, with all information relating to the basis for the notification or the maintenance of the competence of the body concerned. 3. The Commission shall ensure that all sensitive information obtained in the course of its investigations is treated confidentially. 4. Where the Commission ascertains that a notified body does not meet or no longer meets the requirements for its notification, it shall inform the notifying Member State accordingly and request it to take the necessary corrective measures, including de-notification if necessary."
