term,definition,source_anchor,notes
access control,A way of ensuring that only authorised users (or automated systems) can access data or services.,https://www.ncsc.gov.uk/section/advice-guidance/glossary,see also: authentication
account freezing,"Temporarily suspending an account, in response to the detection of unusual/suspicious activity.",https://www.ncsc.gov.uk/section/advice-guidance/glossary,see also: throttling
active cyber defence,A set of NCSC services that are designed to reduce high-volume commodity cyber attacks.,https://www.ncsc.gov.uk/section/advice-guidance/glossary,also known as: acd; mail check; web check | see also: acd; mail check; web check
administrator,"A person who manages a computer system, usually with highly privileged access to data and services.",https://www.ncsc.gov.uk/section/advice-guidance/glossary,also known as: admin
ai,"Artificial intelligence (AI) describes computer systems which can perform tasks usually requiring human intelligence. This could include visual perception, speech recognition or translation between languages.",https://www.ncsc.gov.uk/section/advice-guidance/glossary,also known as: artificial intelligence; machine learning | see also: artificial intelligence; machine learning
allow list,"A security strategy organisations can use that approves a list of email addresses, IP addresses, domain names or applications, while denying all others, to protect computers and networks from threats.",https://www.ncsc.gov.uk/section/advice-guidance/glossary,also known as: whitelist whitelisting and blacklisting is still used across the industry; but the ncsc do not use these terms. read more why in our blog post: /blog-post/terminology-its-not-black-and-white; deny list | see also: whitelist whitelisting and blacklisting is still used across the industry; but the ncsc do not use these terms. read more why in our blog post: /blog-post/terminology-its-not-black-and-white; deny list
android,"Google's mobile operating system, used by several smartphone and tablet manufacturers.",https://www.ncsc.gov.uk/section/advice-guidance/glossary,see also: operating system
anti-malware,"Software that is designed to detect, stop and remove malicious software (malware).",https://www.ncsc.gov.uk/section/advice-guidance/glossary,see also: antivirus
antivirus,"Software that is designed to detect, stop and remove viruses and other kinds of malicious software.",https://www.ncsc.gov.uk/section/advice-guidance/glossary,also known as: av; anti-malware | see also: av; anti-malware
application,A software program running on a computer. Usually referred to as an 'app' when running on a smartphone or tablet.,https://www.ncsc.gov.uk/section/advice-guidance/glossary,also known as: app
apt,Advanced persistent threat. A nation-state or highly capable criminal actor that gains unauthorised access to a system and remains undetected for a long time.,https://www.ncsc.gov.uk/section/advice-guidance/glossary,also known as: advanced persistent threat; hacker | see also: advanced persistent threat; hacker
artificial intelligence,"Artificial intelligence (AI) describes computer systems which can perform tasks usually requiring human intelligence. This could include visual perception, speech recognition or translation between languages.",https://www.ncsc.gov.uk/section/advice-guidance/glossary,also known as: ai; machine intelligence; machine learning | see also: ai; machine intelligence; machine learning
asset management,"Identifying and recording of an organisation's physical assets, software, data, essential staff and utilities.",https://www.ncsc.gov.uk/section/advice-guidance/glossary,see also: configuration management
attack tree,A systematic method for analysing and depicting the different ways a computer system might be attacked.,https://www.ncsc.gov.uk/section/advice-guidance/glossary,see also: hacker
attack vector,The method an attacker uses to gain unauthorised access to a computer system or device.,https://www.ncsc.gov.uk/section/advice-guidance/glossary,see also: hacker
attacker,Individual or group that conduct cyber attacks.,https://www.ncsc.gov.uk/section/advice-guidance/glossary,also known as: threat actor; cyber attack | see also: threat actor; cyber attack
authentication,The process of determining if someone (or something) is who (or what) it claims to be.,https://www.ncsc.gov.uk/section/advice-guidance/glossary,see also: credentials; access control
autorun,An option in Windows to automatically run programs contained on removable media when inserted into the device.,https://www.ncsc.gov.uk/section/advice-guidance/glossary,see also: removable media
backup,"A copy of computer data, usually stored in the cloud or on removable media, that can be used to recover from data loss or theft.",https://www.ncsc.gov.uk/section/advice-guidance/glossary,
bgp,"Border Gateway Protocol. A protocol that exchanges routing information across the internet, typically between ISPs or large organisations.",https://www.ncsc.gov.uk/section/advice-guidance/glossary,also known as: border gateway protocol; isp | see also: border gateway protocol; isp
biometrics,A type of authentication based on biological data that is unique and specific to a person (such as a fingerprint or face ID).,https://www.ncsc.gov.uk/section/advice-guidance/glossary,see also: authentication
bios,"Basic input-output system. The firmware built into PCs that connect the vital components, now superseded by UEFI.",https://www.ncsc.gov.uk/section/advice-guidance/glossary,also known as: basic input-output system; uefi | see also: basic input-output system; uefi
bluetooth,"A short-range, wireless means of communicating between devices (mobile phones, tablets, computers).",https://www.ncsc.gov.uk/section/advice-guidance/glossary,see also: wifi
botnet,"A distributed network of infected devices on the internet, used to commit co-ordinated cyber attacks without their owner's knowledge.",https://www.ncsc.gov.uk/section/advice-guidance/glossary,see also: ddos
breach,"An incident in which data, computer systems or networks are accessed or affected without authorisation.",https://www.ncsc.gov.uk/section/advice-guidance/glossary,also known as: data breach
browser,"An application that displays information and accesses services from the web. Edge, Safari, Firefox and Chrome are all browsers.",https://www.ncsc.gov.uk/section/advice-guidance/glossary,also known as: web browser; www | see also: web browser; www
brute force attack,An attack that uses computing power to automatically enter a large number of guesses for security credentials in an attempt to gain unauthorised access.,https://www.ncsc.gov.uk/section/advice-guidance/glossary,see also: credentials
bulk data,Term used to describe large quantities of (often personal) data that needs special protection.,https://www.ncsc.gov.uk/section/advice-guidance/glossary,see also: encryption
byod,"Bring your own device. When employees use their own device(s) for work purposes, but the employer owns corporate data and resources that may be accessed or stored on it.",https://www.ncsc.gov.uk/section/advice-guidance/glossary,also known as: bring your own device
ca,Certificate authority. An organisation that issues digital certificates to allow the authentication and secure exchange of data,https://www.ncsc.gov.uk/section/advice-guidance/glossary,also known as: certificate authority
carrier,"An organisation that offers communication services over land-wire, sea cable, mobile, and/or satellite systems.",https://www.ncsc.gov.uk/section/advice-guidance/glossary,also known as: isp | see also: isp
cas,Competent authorities. The organisations responsible for enforcing regulation under the NIS Directive.,https://www.ncsc.gov.uk/section/advice-guidance/glossary,also known as: competent authorities
certificate,"A form of digital identity for a computer, user or organisation to allow the authentication and secure exchange of data.",https://www.ncsc.gov.uk/section/advice-guidance/glossary,see also: ca
certification,"A form of digital identity for a computer, user or organisation to allow the authentication and secure exchange of data.",https://www.ncsc.gov.uk/section/advice-guidance/glossary,
chatgpt,"An artificial intelligence language model developed by OpenAI designed to mimic human conversation, based on the input it receives.",https://www.ncsc.gov.uk/section/advice-guidance/glossary,see also: ai; large language model; llm; artificial intelligence
cloud,"An on-demand, massively scalable service, hosted on shared infrastructure, accessible via the internet. Typical services include providing data storage, data processing, and pre-built functionality, such as logging.",https://www.ncsc.gov.uk/section/advice-guidance/glossary,
cms,"Content Management System. Software used to create, manage and publish digital content, usually to the web.",https://www.ncsc.gov.uk/section/advice-guidance/glossary,also known as: content management system
configuration management,"Processes for defining and maintaining the consistency of configurations of software, hardware and other elements of an organisation to ensure reliable performance through its life.",https://www.ncsc.gov.uk/section/advice-guidance/glossary,see also: asset management
credential stuffing,"A method where attackers use passwords stolen from one web service to try and access accounts on another service, taking advantage of any reuse of username and password combinations.",https://www.ncsc.gov.uk/section/advice-guidance/glossary,see also: credentials; passwords
credentials,"Information used to verify someone's identity, such as a password, token or certificate, that authenticates use of a service.",https://www.ncsc.gov.uk/section/advice-guidance/glossary,see also: passwords
critical national infrastructure (cni),"National assets that are essential for the functioning of society, such as those associated with energy supply, water supply, transportation, health and telecommunications.",https://www.ncsc.gov.uk/section/advice-guidance/glossary,also known as: cni
cryptography,Technologies primarily based on maths and computer science for protecting information so that it is only accessible to authorised recipients.,https://www.ncsc.gov.uk/section/advice-guidance/glossary,see also: encryption
csirt,Cyber security incident response team. An expert group that manages the response to a cyber security event or incident.,https://www.ncsc.gov.uk/section/advice-guidance/glossary,also known as: computer security incident response team
cyber assessment framework,A tool for assessing how well suppliers of essential services are managing cyber security risks under the NIS Directive.,https://www.ncsc.gov.uk/section/advice-guidance/glossary,also known as: caf
cyber attack,"An attempt to damage, disrupt or gain unauthorised access to computer systems, networks or devices.",https://www.ncsc.gov.uk/section/advice-guidance/glossary,also known as: hack incident; attacker; cyber threat; hacker; insider threat | see also: hack incident; attacker; cyber threat; hacker; insider threat
cyber essentials,"A government-backed, industry supported scheme to help organisations protect themselves against common cyber attacks.",https://www.ncsc.gov.uk/section/advice-guidance/glossary,see also: cyber attack
cyber security,"The protection of devices, services and networks - and the information on them - from unauthorised access, theft or damage.",https://www.ncsc.gov.uk/section/advice-guidance/glossary,see also: ncsc
cyber strategy,A long-term plan of action with the aim of implementing cyber security.,https://www.ncsc.gov.uk/section/advice-guidance/glossary,see also: ncsc
cyber threat,"The threat of a cyber attack to a user or organisation, and the unauthorised access, theft or damage that could result.",https://www.ncsc.gov.uk/section/advice-guidance/glossary,see also: hacker; cyber attack
cyberfirst,Scheme run by the NCSC that encourage children and young adults to consider a career in cyber security.,https://www.ncsc.gov.uk/section/advice-guidance/glossary,
data at rest,"Data in a persistent state such as when stored on hard disks, removable media or backups.",https://www.ncsc.gov.uk/section/advice-guidance/glossary,see also: removable media
data centre,A managed facility that houses data storage and computer systems.,https://www.ncsc.gov.uk/section/advice-guidance/glossary,
data in transit,"Data as it is transferred from one location to another, either through a private network or the internet.",https://www.ncsc.gov.uk/section/advice-guidance/glossary,see also: data at rest
ddos,"Distributed Denial of Service. A type of cyber attack where a computer service is overloaded by requests from multiple computers or locations, so that real users can no longer access the service.",https://www.ncsc.gov.uk/section/advice-guidance/glossary,also known as: distributed denial of service; botnet; dos | see also: distributed denial of service; botnet; dos
decryption,Making information that has been encrypted readable again.,https://www.ncsc.gov.uk/section/advice-guidance/glossary,see also: cryptography
deny list,A security control that organisations can put in place which blocks their users from connecting to or accessing named entities (such as IP addresses or domains) that may be suspicious.,https://www.ncsc.gov.uk/section/advice-guidance/glossary,also known as: blacklist whitelisting and blacklisting is still used across the industry; but the ncsc do not use these terms. read more about the decision in the blog post - &#039;terminology: it&#039;s not all black and white&#039;; allow list | see also: blacklist whitelisting and blacklisting is still used across the industry; but the ncsc do not use these terms. read more about the decision in the blog post - &#039;terminology: it&#039;s not all black and white&#039;; allow list
devices,"Computer-based hardware that physically exists, such as a desktop computer, smartphone or tablet.",https://www.ncsc.gov.uk/section/advice-guidance/glossary,
dictionary attack,"A type of brute-force attack where words in a dictionary, phrases or common passwords are used to guess credentials.",https://www.ncsc.gov.uk/section/advice-guidance/glossary,see also: brute force attack
digital footprint,The traces of digital information or 'footprint' that a person's online activity leaves behind.,https://www.ncsc.gov.uk/section/advice-guidance/glossary,
digital services,"The provision of services (such as banking or online shopping) via the internet, or an electronic network.",https://www.ncsc.gov.uk/section/advice-guidance/glossary,
digital signature,"A technique used to validate the authenticity and integrity of a message, software or digital document.",https://www.ncsc.gov.uk/section/advice-guidance/glossary,
dkim,"DomainKeys Identified Mail. An email authentication method that adds a digital signature to every outgoing message, to verify the origin of the message.",https://www.ncsc.gov.uk/section/advice-guidance/glossary,see also: mail check
dma,"Direct Memory Access. Allows devices to access main memory outside of the control of the CPU, allowing faster data rates",https://www.ncsc.gov.uk/section/advice-guidance/glossary,
dmarc,Domain-based Messaging and Reporting Conformance. An email authentication and reporting protocol that helps to monitor and improve protection from fraudulent email.,https://www.ncsc.gov.uk/section/advice-guidance/glossary,see also: mail check
dmz,"Demilitarised zone. A controlled segment of an organisation's private network (which typically separates it from the internet), used to host their publicly accessible services such as websites.",https://www.ncsc.gov.uk/section/advice-guidance/glossary,also known as: demilitarised zone; firewall | see also: demilitarised zone; firewall
dns,Domain Name System. The directory service that translates internet domain names (for example www.bbc.co.uk) to their corresponding IP addresses.,https://www.ncsc.gov.uk/section/advice-guidance/glossary,also known as: domain name service; ip address | see also: domain name service; ip address
domain,"A set of network addresses on the internet, managed by an organisation or person.",https://www.ncsc.gov.uk/section/advice-guidance/glossary,
dos,"Denial of Service. A type of cyber attack where a computer service is overloaded, so that real users can no longer access the service.",https://www.ncsc.gov.uk/section/advice-guidance/glossary,also known as: denial of service; ddos | see also: denial of service; ddos
download attack,"A type of cyber attack where the victim unintentionally installs malware (such as viruses) on to a device, without the owner's knowledge.",https://www.ncsc.gov.uk/section/advice-guidance/glossary,also known as: drive-by download; malware | see also: drive-by download; malware
education,The NCSC provides cyber security guidance and resources for the education sector to help protect everyone from schools to universities.,https://www.ncsc.gov.uk/section/advice-guidance/glossary,also known as: research &amp; academia; research & academia | see also: research &amp; academia; research & academia
encryption,Protection of information by making it unreadable by everyone except those with the key to decrypt it.,https://www.ncsc.gov.uk/section/advice-guidance/glossary,see also: cryptography
end user device,"Term to collectively describe modern smartphones, laptops and tablets that connect to an organisation's network.",https://www.ncsc.gov.uk/section/advice-guidance/glossary,also known as: eud; mdm | see also: eud; mdm
enterprise,"Any large business or organisation that uses computer systems, networks and devices.",https://www.ncsc.gov.uk/section/advice-guidance/glossary,
"equality, diversity and inclusion","Equality, Diversity and Inclusion",https://www.ncsc.gov.uk/section/advice-guidance/glossary,
escrow,"A trusted third party service that holds money, software or other assets pending completion of a transaction.",https://www.ncsc.gov.uk/section/advice-guidance/glossary,see also: asset management
ethernet,The networking technology that uses wires (rather than Wi-Fi) to connect devices to networks (including the internet).,https://www.ncsc.gov.uk/section/advice-guidance/glossary,see also: lan
exercising,"Cyber incident exercising helps organisations to establish how resilient they are to cyber attack, and practice their response in a safe environment.",https://www.ncsc.gov.uk/section/advice-guidance/glossary,
exploit,Development of tools to take advantage of a vulnerability in a system to gain unauthorised access or produce unwanted effects,https://www.ncsc.gov.uk/section/advice-guidance/glossary,see also: attacker; vulnerabilities
fido2,Fast IDentity Online 2 is a set of standards that enable authentication using cryptographic keys instead of passwords.,https://www.ncsc.gov.uk/section/advice-guidance/glossary,see also: authentication
fingerprint reader,A biometric device that scans fingerprints to authenticate users.,https://www.ncsc.gov.uk/section/advice-guidance/glossary,see also: biometrics
firewall,Hardware or software used to prevent unauthorised access to or from a network.,https://www.ncsc.gov.uk/section/advice-guidance/glossary,see also: network
firmware,The software embedded into a device that allows it to function.,https://www.ncsc.gov.uk/section/advice-guidance/glossary,see also: bios; uefi
gateway,Networking appliance that allows data to flow between different types of networks.,https://www.ncsc.gov.uk/section/advice-guidance/glossary,see also: router
hacker,"Someone who uses their technology skills to break into computers, systems and networks.",https://www.ncsc.gov.uk/section/advice-guidance/glossary,see also: attacker
hashing,Converting data into a fixed-length unreadable format that can't easily be reversed. Commonly used to protect passwords.,https://www.ncsc.gov.uk/section/advice-guidance/glossary,see also: cryptography; encryption; salt
honeypot,Infrastructure (such as a web server) designed to attract attackers in order to learn how better to defend systems.,https://www.ncsc.gov.uk/section/advice-guidance/glossary,see also: attacker
host,"A network endpoint. For example, a PC, laptop, smartphone or tablet.",https://www.ncsc.gov.uk/section/advice-guidance/glossary,
hotspot,The physical location within the range of a wifi access point that provides access to the internet.,https://www.ncsc.gov.uk/section/advice-guidance/glossary,see also: wifi
hypervisor,Computer software or hardware that can run and manage one or more virtual machines.,https://www.ncsc.gov.uk/section/advice-guidance/glossary,
ics,"Industrial Control System. Systems, often involved with critical national infrastructure, which control and respond to physical feedback.",https://www.ncsc.gov.uk/section/advice-guidance/glossary,also known as: industrial control system; critical national infrastructure (cni) | see also: industrial control system; critical national infrastructure (cni)
identity provider,"An organisation (such as Google, Microsoft and Facebook) that provides online user identification on behalf of third parties.",https://www.ncsc.gov.uk/section/advice-guidance/glossary,
incident management,"Activities to identify, analyse, and determine the response to cyber security incidents, to minimise the immediate and long-term business impact.",https://www.ncsc.gov.uk/section/advice-guidance/glossary,see also: operational security
information assurance,"Managing the risks to data, networks and information systems",https://www.ncsc.gov.uk/section/advice-guidance/glossary,also known as: ia; risk management | see also: ia; risk management
infrastructure as a service (iaas),A business model where consumers access virtualised hardware and software resources over the internet.,https://www.ncsc.gov.uk/section/advice-guidance/glossary,also known as: iaas; platform as a service (paas); software as a service (saas) | see also: iaas; platform as a service (paas); software as a service (saas)
insider threat,Deliberate or accidental threat to an organisation's security from someone who has authorised access (such as an employee).,https://www.ncsc.gov.uk/section/advice-guidance/glossary,see also: attacker
internet,"The global 'network of networks' that provides a vast range of services such as the world wide web, email, social media and streaming services.",https://www.ncsc.gov.uk/section/advice-guidance/glossary,see also: www
internet of things,"Technology describing everyday objects (rather than computers and smartphones) that can connect to the internet. Examples include speakers, televisions and security cameras.",https://www.ncsc.gov.uk/section/advice-guidance/glossary,also known as: iot
ip,"Internet Protocol.  A communications protocol that relays data over network boundaries, and establishes routing across the internet.",https://www.ncsc.gov.uk/section/advice-guidance/glossary,also known as: internet protocol; bgp; ip address; router; protocol | see also: internet protocol; bgp; ip address; router; protocol
ip address,Internet Protocol address. A number assigned to each device that is sending or receiving data across the internet or a LAN.,https://www.ncsc.gov.uk/section/advice-guidance/glossary,see also: ip; router
ipsec,"Internet Protocol Security. A suite of protocols that secures data sent over an IP network, often used to establish VPNs.",https://www.ncsc.gov.uk/section/advice-guidance/glossary,also known as: internet protocol security; vpn | see also: internet protocol security; vpn
isp,"Internet Service Provider. A company that provides individuals and organisations access to the internet, and other related services.",https://www.ncsc.gov.uk/section/advice-guidance/glossary,also known as: internet service provider; carrier | see also: internet service provider; carrier
ixp,Internet Exchange Point. A location where ISPs exchange data between their networks.,https://www.ncsc.gov.uk/section/advice-guidance/glossary,also known as: internet exchange point
keylogger,Hardware or software used to covertly record each keystroke entered into a computer or device.,https://www.ncsc.gov.uk/section/advice-guidance/glossary,see also: end user device; keystroke
keystroke,A single press of a key on a computer.,https://www.ncsc.gov.uk/section/advice-guidance/glossary,
kms,"Key management system. The processes used to generate, store, share, use and destroy cryptographic keys",https://www.ncsc.gov.uk/section/advice-guidance/glossary,
lan,"Local area network. A collection of computers and devices in the same location (usually a building), connected by ethernet or wifi.",https://www.ncsc.gov.uk/section/advice-guidance/glossary,also known as: local area network; wan; wifi | see also: local area network; wan; wifi
large language model,"Large language models (LLMs) use algorithms trained on a huge amount of data, turning relationships between pieces of data into probabilities to predict sequences of text (or increasingly other content) in response to user prompts.",https://www.ncsc.gov.uk/section/advice-guidance/glossary,also known as: llm; ai; artificial intelligence | see also: llm; ai; artificial intelligence
llm,"Large language models (LLMs) use algorithms trained on a huge amount of data, turning relationships between pieces of data into probabilities to predict sequences of text (or increasingly other content) in response to user prompts.",https://www.ncsc.gov.uk/section/advice-guidance/glossary,also known as: large language model; ai; artificial intelligence | see also: large language model; ai; artificial intelligence
logging,"Generating, capturing, retaining and storing information on security-relevant events or behaviour from computer systems.",https://www.ncsc.gov.uk/section/advice-guidance/glossary,also known as: security monitoring | see also: security monitoring
