term,definition,source_anchor,notes
machine learning,Machine learning (ML) is a type of AI by which computers find patterns in data or solve problems automatically without having to be explicitly programmed. Most AI in current use is built using ML techniques.,https://www.ncsc.gov.uk/section/advice-guidance/glossary,also known as: ml; ai | see also: ml; ai
macro,A small program that can automate tasks in applications (such as Microsoft 365) which attackers can exploit to cause harm.,https://www.ncsc.gov.uk/section/advice-guidance/glossary,see also: vulnerabilities
mail check,An NCSC service that helps public sector organisations improve the security of their email domains.,https://www.ncsc.gov.uk/section/advice-guidance/glossary,see also: active cyber defence
malvertising,Using online advertising as a delivery method for malware.,https://www.ncsc.gov.uk/section/advice-guidance/glossary,also known as: malicious advertising; malware | see also: malicious advertising; malware
malware,"Derived from 'malicious software', malware is any kind of software that can damage computer systems, networks or devices. Includes viruses, ransomware and trojans.",https://www.ncsc.gov.uk/section/advice-guidance/glossary,also known as: malicious software; virus | see also: malicious software; virus
mdm,"Mobile Device Management. Software that simplifies the administration and configuration of smartphones, laptops, tablets and other devices across an organisation.",https://www.ncsc.gov.uk/section/advice-guidance/glossary,also known as: mobile device management; devices | see also: mobile device management; devices
metadata,Metadata describes the properties of data and communications. Examples include file date and packet size.,https://www.ncsc.gov.uk/section/advice-guidance/glossary,
mitigation,Actions that organisations and individuals can take to minimise and address risks.,https://www.ncsc.gov.uk/section/advice-guidance/glossary,
monitoring,The analysis of logging information to identify unusual events or patterns of behaviour.,https://www.ncsc.gov.uk/section/advice-guidance/glossary,see also: logging
national protective security authority (npsa),The National Protective Security Authority (NPSA) is the UK’s National Technical Authority for physical and personnel protective security.,https://www.ncsc.gov.uk/section/advice-guidance/glossary,also known as: npsa
ncsc,"The National Cyber Security Centre, the UK national technical authority for cyber security.",https://www.ncsc.gov.uk/section/advice-guidance/glossary,also known as: national cyber security centre
ncsc for startups,An NCSC initiative where startup organisations work with NCSC experts to address important cyber challenges.,https://www.ncsc.gov.uk/section/advice-guidance/glossary,
network,Multiple computers and/or devices connected to shared resources and information.,https://www.ncsc.gov.uk/section/advice-guidance/glossary,see also: lan; wan
oauth,"A protocol that allows a 3rd party (for example, Google or Microsoft) to authorise access to services on a user's behalf.",https://www.ncsc.gov.uk/section/advice-guidance/glossary,see also: authentication
oem,Original Equipment Manufacturer. An organisation that makes hardware or software that's used in other products.,https://www.ncsc.gov.uk/section/advice-guidance/glossary,also known as: original equipment manufacturer
open source,"When referring to software, software for which the source code is made freely available for use and modification.",https://www.ncsc.gov.uk/section/advice-guidance/glossary,
operating system,"The basic software running on computers, tablets and smartphones, required to run additional applications and hardware.",https://www.ncsc.gov.uk/section/advice-guidance/glossary,also known as: os; platform | see also: os; platform
operational security,"The day-to-day protection of computer systems from cyber attack. Examples include backup, incident management and patching.",https://www.ncsc.gov.uk/section/advice-guidance/glossary,see also: incident management; patching
operational technology,"Technology that interfaces with the physical world and includes Industrial Control Systems (ICS), Supervisory Control and Data Acquisition (SCADA) and Distributed Control Systems (DCS)",https://www.ncsc.gov.uk/section/advice-guidance/glossary,also known as: ot
passkeys,A more secure alternative to passwords that you don't need to remember as they are created and managed safely on your device(s).,https://www.ncsc.gov.uk/section/advice-guidance/glossary,see also: authentication; passwords
passphrase,"A sequence of words or other characters longer than a normal password, used to verify the identity of a user, usually to gain access to an account, website or system.",https://www.ncsc.gov.uk/section/advice-guidance/glossary,see also: passwords
password manager,"Software which can generate, store and retrieve passwords.",https://www.ncsc.gov.uk/section/advice-guidance/glossary,see also: passwords
password spraying,Using a small number of commonly-used passwords in an attempt to access to a large number of accounts.,https://www.ncsc.gov.uk/section/advice-guidance/glossary,see also: brute force attack
passwords,"A sequence of characters used to verify the identity of a user, usually to gain access to an account, website or system.",https://www.ncsc.gov.uk/section/advice-guidance/glossary,see also: passphrase
patching,Installing updates to devices or software to improve security and/or enhance functionality.,https://www.ncsc.gov.uk/section/advice-guidance/glossary,see also: vulnerabilities
pattern,An architectural pattern for secure system design,https://www.ncsc.gov.uk/section/advice-guidance/glossary,also known as: system design
penetration testing,"An authorised test of a computer network or system, designed to look for security weaknesses with the end aim of fixing them.",https://www.ncsc.gov.uk/section/advice-guidance/glossary,also known as: pen testing; pentest; vulnerabilities | see also: pen testing; pentest; vulnerabilities
pentest,"Short for 'penetration testing,' an authorised test of a computer network or system, designed to look for security weaknesses with the end aim of fixing them.",https://www.ncsc.gov.uk/section/advice-guidance/glossary,also known as: penetration test
people-centred security,Cyber security that focuses on the behavioural traits of the people who follow the processes put in place by organisations.,https://www.ncsc.gov.uk/section/advice-guidance/glossary,
personal data,"Information that relates to an identified or identifiable individual, such as a name or number, or information such as an IP address.",https://www.ncsc.gov.uk/section/advice-guidance/glossary,
personnel security,Protecting organisations from the risks associated with the people it employs.,https://www.ncsc.gov.uk/section/advice-guidance/glossary,
pharming,"A cyber attack where a person is misdirected to a fraudulent website, despite them entering the correct address.",https://www.ncsc.gov.uk/section/advice-guidance/glossary,
phishing,"Scam emails or text messages that contain links to websites which may contain malware, or may trick users into revealing sensitive information (such as passwords) or transferring money.",https://www.ncsc.gov.uk/section/advice-guidance/glossary,see also: smishing; spear-phishing; whaling; malware
physical security,"Protecting the places where people work, and the locations of systems, services and networks.",https://www.ncsc.gov.uk/section/advice-guidance/glossary,
plain text,"In cryptography, plain text refers to text that has not been encrypted (and is therefore easily readable).",https://www.ncsc.gov.uk/section/advice-guidance/glossary,also known as: clear text
platform,"Hardware or software environments on which applications can run. Software examples include Windows, Android and iOS. Hardware examples include PCs and Mac computers.",https://www.ncsc.gov.uk/section/advice-guidance/glossary,
platform as a service (paas),"A business model that allows developers to create and manage software applications, without having to own or maintain the physical infrastructure on which they run.",https://www.ncsc.gov.uk/section/advice-guidance/glossary,see also: infrastructure as a service (iaas); software as a service (saas)
powershell,"A powerful command-line tool and scripting language, often used to automate administrative and configuration tasks on Windows computers.",https://www.ncsc.gov.uk/section/advice-guidance/glossary,
protocol,"A set of rules that determine how data is handled, protected and transmitted between devices on a network.",https://www.ncsc.gov.uk/section/advice-guidance/glossary,
ransomware,"A type of malware which prevents you from accessing your device and the data stored on it, usually by encrypting your files. A criminal group will then demand a ransom in exchange for decryption.",https://www.ncsc.gov.uk/section/advice-guidance/glossary,see also: malware
ransomware as a service,"A business model where consumers purchase ransomware services 'off the shelf', without requiring the technical skills to develop the malware.",https://www.ncsc.gov.uk/section/advice-guidance/glossary,also known as: raas; ransomware; malware | see also: raas; ransomware; malware
remote working,Working away from your business premises.,https://www.ncsc.gov.uk/section/advice-guidance/glossary,also known as: home working; teleworking; byod | see also: home working; teleworking; byod
removable media,"Devices such as USB flash drives, DVDs and memory cards, that can be easily removed from a computer to increase storage capacity (or to transfer data).",https://www.ncsc.gov.uk/section/advice-guidance/glossary,
research &amp; academia,Research & Academia and education,https://www.ncsc.gov.uk/section/advice-guidance/glossary,also known as: education
rfc,"Request for Comments. Detailed proposals concerning an aspect of internet technology, many of which become internet standards.",https://www.ncsc.gov.uk/section/advice-guidance/glossary,also known as: request for comments
rfid,"Radio frequency identification. Technology that uses electromagnetic fields to identify, track and share data between tags within objects or worn by people.",https://www.ncsc.gov.uk/section/advice-guidance/glossary,also known as: radio frequency identification
risk,"Possible future outcomes that we can describe in terms of their chances of occurrence, and the impact they would have if realised.",https://www.ncsc.gov.uk/section/advice-guidance/glossary,see also: risk management
risk appetite,The level of risk that an organisation is prepared to take in pursuit of its objectives.,https://www.ncsc.gov.uk/section/advice-guidance/glossary,see also: risk; risk management
risk management,"The means of governing, communicating and making decisions about risk.",https://www.ncsc.gov.uk/section/advice-guidance/glossary,see also: risk; risk appetite; risk owner
risk owner,A person who is accountable for risk within an organisation.,https://www.ncsc.gov.uk/section/advice-guidance/glossary,see also: risk management
router,A device which sends data from one network to another based on the destination IP address.,https://www.ncsc.gov.uk/section/advice-guidance/glossary,see also: gateway; ip address
rpz,Response policy zone. A filtering mechanism that prevents users from visiting harmful internet sites. Also known as a DNS firewall.,https://www.ncsc.gov.uk/section/advice-guidance/glossary,also known as: response policy zone; dns | see also: response policy zone; dns
salt,Random data that is added to the password hashing process to help protect against dictionary attacks.,https://www.ncsc.gov.uk/section/advice-guidance/glossary,see also: hashing
sanitisation,Techniques that ensure data stored on devices is removed so that it can no longer be recovered by unauthorised parties.,https://www.ncsc.gov.uk/section/advice-guidance/glossary,
secure by default,"Technology in which security is embedded from its inception, and is frictionless for the user. Security is treated as a core fundamental rather than a follow-up activity.",https://www.ncsc.gov.uk/section/advice-guidance/glossary,
secure design and development,Activities relating to the design and development of IT systems and software that are secure by default.,https://www.ncsc.gov.uk/section/advice-guidance/glossary,
secure storage,Protecting digitally stored information using physical and electronic techniques.,https://www.ncsc.gov.uk/section/advice-guidance/glossary,
security architecture,"The practice of designing the technology, people and processes within computer systems to achieve security goals.",https://www.ncsc.gov.uk/section/advice-guidance/glossary,
security monitoring,"Active analysis by organisations of logging information to look for signs of attacks or unusual behaviour, to help detect events that could be considered an incident and to respond accordingly.",https://www.ncsc.gov.uk/section/advice-guidance/glossary,also known as: protective monitoring; logging; soc; siem | see also: protective monitoring; logging; soc; siem
server,A software- or hardware-based device that accepts and responds to requests made over a network.,https://www.ncsc.gov.uk/section/advice-guidance/glossary,
shadow it,Refers to the unknown assets that are used within an organisation for business purposes.,https://www.ncsc.gov.uk/section/advice-guidance/glossary,also known as: grey it
shoulder surfing,Observing information (such as a password) as it is being typed into a screen.,https://www.ncsc.gov.uk/section/advice-guidance/glossary,see also: passwords
siem,"Technology that supports threat detection and security management by collecting, monitoring and analysing security-related data from computer logs and alerts.",https://www.ncsc.gov.uk/section/advice-guidance/glossary,also known as: security information and event management; logging | see also: security information and event management; logging
single sign-on,Using a single set of credentials (such as the same login and password combination) to access multiple services.,https://www.ncsc.gov.uk/section/advice-guidance/glossary,also known as: sso; credentials | see also: sso; credentials
smishing,"Combination of 'SMS' and 'Phishing'. Untargeted text messages sent to large numbers of people, asking for sensitive information, or encouraging them to visit a fake website.",https://www.ncsc.gov.uk/section/advice-guidance/glossary,also known as: sms phishing; phishing | see also: sms phishing; phishing
soc,"Security operations centre. A centralised facility within an organisation, responsible for activities such as security monitoring and incident management.",https://www.ncsc.gov.uk/section/advice-guidance/glossary,also known as: security operations centre; incident management; security monitoring | see also: security operations centre; incident management; security monitoring
social engineering,"A technique an attacker uses to manipulate people into carrying out specific actions, or divulging information.",https://www.ncsc.gov.uk/section/advice-guidance/glossary,see also: phishing; smishing; spear-phishing; whaling
social media,"Websites and apps, such as Facebook, X and Instragram, that allow people to share and respond to user-generated content (text posts, photos and video).",https://www.ncsc.gov.uk/section/advice-guidance/glossary,see also: digital footprint
sociotechnical security,"Security that accounts for the interaction of technology with people, processes and organisations.",https://www.ncsc.gov.uk/section/advice-guidance/glossary,
software as a service (saas),A business model where customers access centrally hosted software applications over the internet (or network).,https://www.ncsc.gov.uk/section/advice-guidance/glossary,see also: infrastructure as a service (iaas); platform as a service (paas)
spam,"Unsolicited email sent in bulk, also referred to as junk email.",https://www.ncsc.gov.uk/section/advice-guidance/glossary,also known as: junk email
spear-phishing,"A form of phishing targeting particular individuals, where the email is designed to look like it's from a trusted or known person.",https://www.ncsc.gov.uk/section/advice-guidance/glossary,also known as: whaling; phishing | see also: whaling; phishing
spoofing,"A technique attackers use to appear to make their communications appear from a legitimate source. Email addresses, display names and domains can all be spoofed.",https://www.ncsc.gov.uk/section/advice-guidance/glossary,
spyware,"A type of malware that installs on a device without the user's consent, collecting data and then sendng it to a third party.",https://www.ncsc.gov.uk/section/advice-guidance/glossary,see also: malware
ss7,Signalling System 7. An international standard allowing phone networks to exchange the information needed for passing calls and text messages.,https://www.ncsc.gov.uk/section/advice-guidance/glossary,also known as: signalling system 7
ssl,Secure Sockets Layer. An older method of encrypting data to communicate across the internet. Replaced by TLS.,https://www.ncsc.gov.uk/section/advice-guidance/glossary,also known as: secure sockets layer; encryption; tls | see also: secure sockets layer; encryption; tls
supply chain,"The extended network of trading relationships relied upon to deliver products, systems, and services.",https://www.ncsc.gov.uk/section/advice-guidance/glossary,
takedown,The removal of malware and phishing websites to limit the harm they can cause.,https://www.ncsc.gov.uk/section/advice-guidance/glossary,
tethering,"Connecting to a phone using wifi, to share its internet connection.",https://www.ncsc.gov.uk/section/advice-guidance/glossary,see also: wifi
threat intelligence,"Information about threats that has been aggregated, analysed and enriched to provide the useful context for decision-making processes.",https://www.ncsc.gov.uk/section/advice-guidance/glossary,
throttling,Forcing a time delay between successive login attempts in order to defend against brute force attacks.,https://www.ncsc.gov.uk/section/advice-guidance/glossary,see also: brute force attack
tls,"Transport Layer Security. A cryptographic protocol that provides secure communications across computer networks, such as the internet.",https://www.ncsc.gov.uk/section/advice-guidance/glossary,also known as: transport layer security; encryption | see also: transport layer security; encryption
token,"A physical device or digital data, typically used with a password, to provide a user with access to a computer or network.",https://www.ncsc.gov.uk/section/advice-guidance/glossary,see also: passwords
translation monitoring,A branch of security monitoring designed to protect online systems and services.,https://www.ncsc.gov.uk/section/advice-guidance/glossary,see also: security monitoring
trojan,"A type of malware, disguised as legitimate software, that is used to gain unauthorised access to a victim's computer.",https://www.ncsc.gov.uk/section/advice-guidance/glossary,see also: virus
typosquatting,A technique used by threat actors where they set up a website or software with a misspelling of something legitimate. This can trick a user who accidentally misspells a service into entering information into the malicious website or downloading malware.,https://www.ncsc.gov.uk/section/advice-guidance/glossary,also known as: typosquatting; attacker; hacker; cyber attack | see also: typosquatting; attacker; hacker; cyber attack
uefi,Unified Extensible Firmware Interface. A replacement for the BIOS (Basic Input-Output System) firmware that connects a PC's vital components.,https://www.ncsc.gov.uk/section/advice-guidance/glossary,also known as: unified extensible firmware interface; bios; firmware | see also: unified extensible firmware interface; bios; firmware
uk gdpr,UK GDPR is the General Data Protection legislation in the UK that gives citizens more control over their personal data.,https://www.ncsc.gov.uk/section/advice-guidance/glossary,also known as: general data protection regulation
video conferencing,"A live audio and video conversation between two or more people, conducted using phone, tablet, laptop or desktop computer.",https://www.ncsc.gov.uk/section/advice-guidance/glossary,
virtual machine,A virtual environment within a physical computer that behaves like a separate computer. It allows the user to run programs and test apps in isolation.,https://www.ncsc.gov.uk/section/advice-guidance/glossary,
virtualisation,The process of creating a virtual machine.,https://www.ncsc.gov.uk/section/advice-guidance/glossary,
virus,A type of malware that is designed to infect legitimate software programs and replicates across networks when those programs are activated.,https://www.ncsc.gov.uk/section/advice-guidance/glossary,
virus signature,"Files containing data unique to particular pieces of malware, including viruses, that security software downloads in order to aid detection.",https://www.ncsc.gov.uk/section/advice-guidance/glossary,
vpn,Virtual Private Network. A set of cryptographic technologies used to encrypt data as it travels over a network between two fixed endpoints.,https://www.ncsc.gov.uk/section/advice-guidance/glossary,
vulnerabilities,"A weakness, or flaw, in software, a system or process. An attacker exploits these to (for example) gain unauthorised access to a computer system.",https://www.ncsc.gov.uk/section/advice-guidance/glossary,see also: exploit
w3c,The World Wide Web Consortium (W3C) is an international organisation that develops standards for the World Wide Web.,https://www.ncsc.gov.uk/section/advice-guidance/glossary,also known as: world wide web consortium; www | see also: world wide web consortium; www
wan,"Wide area network. A network spread over a large area, typically a collection of Local Area Networks (LANs) and other networks connected together",https://www.ncsc.gov.uk/section/advice-guidance/glossary,also known as: wide area network; lan | see also: wide area network; lan
wannacry,"The name of a ransomware variant that in 2017 infected over 300,000 computers globally causing multiple cyber attacks.",https://www.ncsc.gov.uk/section/advice-guidance/glossary,see also: ransomware
wap,Wireless access point. A device which provides wireless access to a network.,https://www.ncsc.gov.uk/section/advice-guidance/glossary,also known as: wireless access points; network | see also: wireless access points; network
watering hole,"A type of cyber attack where an attacker identifies a website frequented by a particular group of users, and then compromises that website with malware to infect the computers of its visitors.",https://www.ncsc.gov.uk/section/advice-guidance/glossary,also known as: watering hole attack; download attack | see also: watering hole attack; download attack
web check,An NCSC service that helps owners of public sector websites to find and fix common vulnerabilities.,https://www.ncsc.gov.uk/section/advice-guidance/glossary,see also: active cyber defence
whaling,Highly targeted phishing attacks (that look like legitimate emails) aimed at senior executives.,https://www.ncsc.gov.uk/section/advice-guidance/glossary,see also: phishing; spear-phishing
wifi,Wireless network technology used to connect devices to the internet (or LAN).,https://www.ncsc.gov.uk/section/advice-guidance/glossary,see also: lan
wiper,A destructive type of malware that destroys the data on the computers and networks it infects.,https://www.ncsc.gov.uk/section/advice-guidance/glossary,see also: malware; virus
worm,"A type of malware, similar to a virus, which self-replicates across networks without the need for a user to open an infected program.",https://www.ncsc.gov.uk/section/advice-guidance/glossary,see also: malware; virus
www,The World Wide Web (or Web) is an interconnected system of public webpages accessed through the internet.,https://www.ncsc.gov.uk/section/advice-guidance/glossary,also known as: world wide web; internet; browser | see also: world wide web; internet; browser
zero-day,"Recently discovered vulnerability that hackers can explot, where a fix or patch isn't publicly available yet.",https://www.ncsc.gov.uk/section/advice-guidance/glossary,see also: exploit; hacker; vulnerabilities
2-step verification,2-step verification. The use of two different methods (such as a password and an SMS code) to verify a user's identity.,https://www.ncsc.gov.uk/section/advice-guidance/glossary,also known as: 2sv; multi-factor authentication (mfa); two-factor authentication (2fa); authentication; passwords | see also: 2sv; multi-factor authentication (mfa); two-factor authentication (2fa); authentication; passwords
2sv,2-step verification. The use of two different methods (such as a password and an SMS code) to verify a user's identity.,https://www.ncsc.gov.uk/section/advice-guidance/glossary,also known as: 2 step verification; two factor authentication; multi-factor authentication; 2-step verification; authentication | see also: 2 step verification; two factor authentication; multi-factor authentication; 2-step verification; authentication
5g,"5G is the fifth generation of wireless technology being rolled out in the UK, used to deliver the mobile internet without connecting to a cable or wifi. 5G is faster than the previous 3G and 4G generations, with reduced latency (the time between instructing a wireless device to perform an action and that action being completed) and greater capacity, allowing more devices in one area to be connected at the same time.",https://www.ncsc.gov.uk/section/advice-guidance/glossary,see also: tethering
